claim_id,claim,document_id
000001720003,"The Commodity Futures Trading Commission (CFTC) and U.S. Securities and Exchange Commission would see their budgets hold steady at $250 million and $1.6 billion, respectively, under the new budget.",0172
000001720004,The Office of Financial Research is facing a 28 percent budget cut under the new plan.,0172
000001730001,Brian Cornell is the CEO of Target Corp.,0173
000001730002,Juan Luciano is the president and CEO of ADM.,0173
000001730003,"House Speaker Paul Ryan argues that a proposed border tax, estimated at $1 trillion, will not affect prices and allow rate cuts for businesses.",0173
000001740001,President Donald Trump is requesting $1.6 billion from Congress to begin building a wall along the border with Mexico.,0174
000001740002,An internal Department of Homeland Security (DHS) plan in February estimated the total cost for the wall at $21.6 billion.,0174
000001740003,"The White House is requesting $1.6 billion for wall construction, significantly less than the estimated $21.6 billion cost outlined in a February DHS plan.",0174
000001750001,The Trump administration believes its budget plan will boost economic growth.,0175
000001760001,"The budget proposal unveiled by the White House on Tuesday cut all funding to a Department of Homeland Security program known as ""countering violent extremism"".",0176
000001760002,"The ""countering violent extremism"" program provides grants to communities to counter radicalism through outreach.",0176
000001770001,Robert Mueller has been cleared by the U.S. Department of Justice ethics experts to oversee the investigation.,0177
000001770002,An ethics rule limiting government attorneys from investigating people their former law firm represented raised questions over how Mueller would be allowed to operate.,0177
000001780001,The U.S. intelligence community has not initiated an assessment.,0178
000001780002,President Donald Trump disclosed highly classified information.,0178
000001790001,Dan Coats declined to say whether President Donald Trump asked him about denying collusion between his campaign team and Russia.,0179
000001790002,Dan Coats stated that he doesn't feel it's appropriate to characterize discussions and conversations with the president.,0179
000001800001,Dan Coats had no relevant documents to provide regarding memos of any conversations he may have had with President Donald Trump about the Russia investigation.,0180
000001800002,Dan Coats repeatedly declined to say whether President Donald Trump asked him to help deny any collusion between the Trump campaign team and Russia.,0180
000001810001,"U.S. House Speaker Paul Ryan said, ""At least we now have common objectives: grow the economy, balance the budget. So at least we are now on that common ground, and we will have a great debate about the details about how to achieve those goals.""",0181
000001810002,The common objectives identified by Republican leaders and the administration are to grow the economy and balance the budget.,0181
000001820001,President Donald Trump's budget proposal aims to cut $3.6 trillion in government spending over 10 years.,0182
000001820002,Trump's budget proposal seeks to cut more than $800 billion from the Medicaid program and more than $192 billion from food stamps.,0182
000001830001,The U.S. Labor Department will implement its fiduciary rule on June 9.,0183
000001830002,President Trump delayed the original enactment date of the fiduciary rule from April 10 for 60 days.,0183
000001840001,The U.S. Senate voted overwhelmingly on Monday to confirm Iowa Governor Terry Branstad as President Donald Trump's ambassador to Beijing.,0184
000001840002,One of Branstad’s first challenges will be pushing China to take a harder line against North Korea.,0184
000001840003,"Chinese President Xi Jinping has called Branstad, 70, an “old friend” after decades of dealings on agricultural trade during his long career in politics in Iowa.",0184
000001850001,The U.S. Strategic Petroleum Reserve holds about 688 million barrels of crude oil.,0185
000001850002,Congress created the U.S. Strategic Petroleum Reserve in 1975 after the Arab oil embargo.,0185
000001850003,"The Trump budget proposes to start selling SPR oil in fiscal year 2018, generating $500 million.",0185
000001850004,The Trump administration proposed restarting a nuclear waste fund that would bring in more than $3 billion by 2027.,0185
000001860001,President Donald Trump’s fiscal 2018 budget proposal suggests cuts or major structural changes for two Wall Street financial regulators.,0186
000001860002,The U.S. Consumer Financial Protection Bureau (CFPB) would undergo a “restructure” under President Donald Trump’s fiscal 2018 budget proposal.,0186
000001860003,The elimination of the SEC's reserve fund would reduce the deficit by $50 million annually.,0186
000001860004,"The CFPB’s $605.9 million budget is funded by the Federal Reserve, which is not subject to congressional appropriations.",0186
000001870001,The Trump administration’s budget proposal would convert some foreign military grants to loans.,0187
000001870002,The White House budget documents showed total defense spending for the 2018 fiscal year as $603 billion.,0187
000001880001,The Trump administration assumes that economic growth will reach 3 percent annually by the end of Trump's first term and stay there at least through 2027.,0188
000001880002,"Actual first-quarter economic growth was a weak 0.7 percent on an annualized basis, though current Fed forecasts expect about 2.1 percent growth for the year.",0188
000001890001,The White House budget proposed $46.54 billion in cuts to federal government funding for the agriculture sector over the next 10 years.,0189
000001890002,"The biggest cut, $38 billion, would come in the form of reductions to farm supports.",0189
000001890003,The overall proposed budget cuts would eliminate the Rural Economic Development program.,0189
000001900001,Chicago is starting an advertising campaign to reassure immigrants that they are welcome in the third-largest U.S. city.,0190
000001900002,Mayor Rahm Emanuel said on Monday he was not worried about the “One Chicago” campaign upsetting the Trump administration.,0190
000001910001,Two federal judges suspended executive orders restricting travel from several Muslim-majority countries.,0191
000001910002,"On Monday, the U.S. Justice Department asked a federal judge to reconsider a ruling which blocked President Donald Trump's attempt to cut off federal funding for so-called sanctuary cities.",0191
000001920001,Former U.S. Vice-President Al Gore said that U.S. President Donald Trump cannot stop momentum to tackle climate change.,0192
000001920002,"""An Inconvenient Sequel: Truth to Power"" is the follow-up to ""An Inconvenient Truth"", which was credited with bringing climate change into mainstream political discourse in the United States a decade ago.",0192
000001930001,Michael Flynn declined to comply with a subpoena from the Senate Intelligence Committee.,0193
000001930002,"Flynn's attorney stated that Flynn has a ""reasonable apprehension"" that his testimony could be used against him.",0193
000001940001,El Paso County filed a lawsuit in federal court.,0194
000001940002,"El Paso County filed the lawsuit to halt a new law designed to punish ""sanctuary cities"", claiming it was vague, cruel and unconstitutional.",0194
000001940003,The law in Texas takes effect on Sept. 1.,0194
000001950001,The Trump administration requested a postponement of a court case regarding the fate of Obamacare cost-sharing subsidies.,0195
000001950002,The payments for the Obamacare cost-sharing subsidies amount to about $7 billion this year.,0195
000001960001,President Donald Trump is seeking outside counsel to help him during investigations into his campaign and Russian meddling in the 2016 U.S. election.,0196
000001960002,"The four prominent attorneys who are considered finalists for representing Trump are Marc Kasowitz, Robert Giuffra Jr., Reid Weingarten, and Theodore Olson.",0196
000001970001,"In March, President Donald Trump urged Dan Coats and Michael Rogers to publicly deny any evidence of collusion between the Trump campaign and Russia.",0197
000001970002,Dan Coats and Michael Rogers refused to comply with President Trump's requests because they believed them to be inappropriate.,0197
000001980001,Former FBI Director James Comey delayed his appearance before the U.S. House Oversight Committee.,0198
000001980002,"Before testifying in public, James Comey wanted to speak with former FBI Director Robert Mueller.",0198
000001990001,The U.S. Senate Intelligence Committee will vigorously pursue General Flynn's testimony and his production of any and all pertinent materials pursuant to the Committee’s authorities.,0199
000001990002,The Republican and Democratic leaders of the U.S. Senate Intelligence Committee said on Monday they were disappointed Michael Flynn declined their request for an interview and production of subpoenaed documents.,0199
000002000001,US President Donald Trump visited Jerusalem on Monday.,0200
000002000002,"""Shared concern about Iran is driving Israel and many Arab states closer together,"" said US President Donald Trump.",0200
000002010001,Karl Oliver apologized for his choice of words on Monday.,0201
000002010002,Karl Oliver called for the lynching of those responsible for removing Confederate statues in a Facebook post.,0201
000002020001,A brawl erupted between protesters and Turkish security personnel outside the Turkish ambassador’s residence during Erdogan's visit to Washington.,0202
000002020002,Turkey blamed the violence on demonstrators linked to the militant Kurdistan Workers Party.,0202
000002020003,Washington’s police chief described the incident as a “brutal attack” on peaceful protesters.,0202
000002030001,The U.S. Supreme Court ruled that North Carolina Republicans unlawfully considered race when drawing congressional district boundaries.,0203
000002030002,North Carolina Republicans claimed that the 12th congressional district was drawn solely based on partisan aims to benefit Republicans.,0203
000002050001,Sara Netanyahu spoke to Donald Trump and Melania Trump on Monday.,0205
000002050002,"Sara Netanyahu stated that ""the majority of the people of Israel"" love Donald Trump and Melania Trump.",0205
000002060001,"Senator Patty Murray, the top Democrat on the U.S. Senate committee overseeing pensions, asked the U.S. Office of Government Ethics to assess whether President Donald Trump is violating the Constitution.",0206
000002060002,Public pension funds in at least seven U.S. states periodically send millions of dollars to an investment fund that owns the Trump SoHo Hotel and Condominium in New York City.,0206
000002070001,"In 2016, the United States had a trade deficit of nearly $10 billion with Israel.",0207
000002070002,"The United States is Israel’s single-largest trading partner by country, but third-largest regional market behind Europe and Asia.",0207
000002080001,The Republican Party of Louisiana challenged a federal campaign finance restriction that prevents political parties from raising unlimited amounts of cash to spend on supporting candidates.,0208
000002080002,The Supreme Court upheld a lower court's ruling rejecting the Republican Party of Louisiana's challenge to a campaign finance restriction.,0208
000002090001,U.S. President Donald Trump said that Iran must stop its financial and military support for terrorists and militias.,0209
000002090002,U.S. President Donald Trump stated that Iran must never be allowed to possess a nuclear weapon.,0209
000002100001,Myron Ebell stated that he believed the Trump administration was moving too slowly to dismantle climate change regulations.,0210
000002100002,"Myron Ebell cited the slow pace of EPA appointments, including deputy administrator and various assistant administrators, as a reason for his dissatisfaction with the Trump administration's approach to climate regulations.",0210
000002110001,"U.S. President Donald Trump believes there is a rare opportunity to bring security, stability, and peace to the region and its people.",0211
000002110002,U.S. President Donald Trump believes that working together is necessary for achieving security and peace in the region.,0211
000002120001,"Israeli Prime Minister Benjamin Netanyahu hoped that U.S. President Donald Trump's visit to Israel would be a ""historic milestone"" in achieving regional peace.",0212
000002120002,"Israel extended its hand in peace to all its neighbors, including the Palestinians.",0212
000002130001,U.S. Secretary of State Rex Tillerson said on Monday that President Donald Trump was prepared to invest his personal efforts into Middle East peace if Israeli and Palestinian leaders were ready to be serious about engaging in the process.,0213
000002130002,"Rex Tillerson said that a three-way meeting between U.S., Israeli, and Palestinian leaders was for a later date rather than on his current trip.",0213
000002140001,U.S. President Donald Trump arrived in Israel on a flight from Saudi Arabia.,0214
000002140002,U.S. President Donald Trump will meet separately with Israeli Prime Minister Benjamin Netanyahu and Palestinian President Mahmoud Abbas to revive peace talks.,0214
000002140003,Air Force One landed at Tel Aviv's Ben-Gurion airport.,0214
000002140004,His nine-day trip through the Middle East and Europe ends on Saturday.,0214
000002150001,"In a deal announced on Saturday, Saudi Arabia agreed to purchase $110 billion worth of U.S. arms.",0215
000002150002,Israel considers Iran a security threat but possesses a military advantage over Arab states.,0215
000002160001,Melania Trump praised the empowerment of women at a General Electric all-female service center in Riyadh.,0216
000002160002,Melania Trump shared a photo with seven women dressed in abayas.,0216
000002170001,Mohammad Javad Zarif criticized Donald Trump for sealing an arms deal with Saudi Arabia.,0217
000002170002,"In his first keynote speech abroad, Donald Trump urged Arab and Islamic leaders to unite and defeat Islamist extremists.",0217
000002170003,Hassan Rouhani won a second term as Iran's president.,0217
000002170004,Mohammad Javad Zarif referred to Saudi Arabia being milked of $480 billion.,0217
000002180001,Reince Priebus is returning to Washington after completing the Saudi Arabia portion of President Donald Trump's trip.,0218
000002180002,Reince Priebus planned to return early because the White House is unveiling its full budget this week.,0218
000002190001,Trump did not make overt mentions of human rights abuses in Saudi Arabia or other Gulf nations.,0219
000002190002,"Trump's approach to Iran differed from Obama's, with Trump focusing on Iran's support for terrorism and its threats towards Israel and America.",0219
000002190003,"Iranian Foreign Minister Mohammad Javad Zarif criticized Trump for attacking Iran ""in that bastion of democracy & moderation"" of Saudi Arabia and suggested Trump had ""milked"" his hosts for business deals.",0219
000002200001,The U.S. Department of Defense is assessing its ability to recruit transgender people as soon as 1 July.,0220
000002200002,The Pentagon ended its ban on openly transgender people serving in the U.S. military last year.,0220
000002210001,Donald Trump's budget proposal will include cuts to Medicaid and propose changes to other assistance programs for low-income citizens.,0221
000002210002,A Republican healthcare bill passed the U.S. House of Representatives in early May.,0221
000002210003,"Over 44 million Americans received benefits from the SNAP program in February, according to the U.S. Department of Agriculture.",0221
000002220001,Donald Trump discussed the firing of James Comey with Russian Foreign Minister Sergei Lavrov during a meeting on May 10.,0222
000002220002,"Republican Senator John McCain expressed being ""speechless"" in response to reports of Donald Trump's comments about James Comey during the May 10 meeting.",0222
000002230001,Sebastien Ogier won the Rally of Portugal for a record-equaling fifth time.,0223
000002230002,Sebastien Ogier leads Thierry Neuville by a margin of 22 points.,0223
000002240001,<OUTPUT> U.S. President Donald Trump discussed his firing of FBI Director James Comey with Russia's foreign minister Sergei Lavrov to explain why he felt unable to cooperate with Russia.</OUTPUT>,0224
000002240002,"<OUTPUT> During a May 10 meeting, U.S. President Donald Trump said that he fired the head of the FBI, James Comey, because ""He was crazy, a real nut job."" </OUTPUT>",0224
000002250001,James Comey agreed to testify before the U.S. Senate Intelligence Committee.,0225
000002250002,The public hearing will be scheduled after the May 29 Memorial Day holiday.,0225
000002260001,President Donald Trump fired FBI Director James Comey.,0226
000002260002,A special counsel was appointed to investigate the Russia ties.,0226
000002270001,"Many top State Department posts remain vacant, limiting the expertise available for briefing Trump on crucial foreign policy matters.",0227
000002270002,Decision-making power within the Trump administration appears to be concentrated among a select few loyalists.,0227
000002270003,The White House has been slower than previous administrations in sending nominees to the Senate for confirmation.,0227
000002280001,Trump may have attempted to obstruct the investigation into his former national security advisor.,0228
000002280002,The appointment of a special counsel indicates a serious need for an independent investigation into Russian interference and possible collusion by the Trump campaign.,0228
000002280003,"The White House has provided inconsistent reasons for Comey's dismissal, raising questions about transparency.",0228
000002290001,Democratic Senator Ron Wyden believes that Republican leadership is moving away from full-scale tax reform and toward simply cutting rates.,0229
000002290002,"Mitch McConnell, the Senate majority leader, has recently been discussing tax cuts rather than tax reform.",0229
000002290003,Ron Wyden argues there is robust bipartisan agreement that a major tax overhaul is needed.,0229
000002300001,"Public approval of President Donald Trump dropped to its lowest level since his inauguration, according to a Reuters/Ipsos poll released on Friday.",0230
000002300002,The May 14-18 opinion poll found that 38 percent of adults approved of Trump while 56 percent disapproved.,0230
000002310001,President Donald Trump plans to nominate Callista Gingrich as ambassador to the Vatican.,0231
000002310002,Callista Gingrich is the wife of former Republican House Speaker Newt Gingrich.,0231
000002310003,Callista Gingrich produces documentary films on public policy and history.,0231
000002320001,Senator Ron Wyden believes the Congress has a broader oversight responsibility than just whether crimes have been committed.,0232
000002320002,The Senate Intelligence Committee is conducting one of the main congressional probes of the issue.,0232
000002330001,U.S. President Donald Trump has nominated Marine General Joseph Dunford to continue serving as his top military adviser.,0233
000002330002,Joseph Dunford was first named chairman of the Joint Chiefs of Staff in 2015.,0233
000002340001,Anthony Weiner pleaded guilty to sending sexually explicit messages to a teenage girl.,0234
000002340002,"Hours after Weiner's court hearing, Huma Abedin filed for divorce in a Manhattan court.",0234
000002340003,"Weiner could face a maximum sentence of unspecified length, but is likely to receive a sentence within a range determined by his plea agreement.",0234
000002350001,The Trump administration is exploring whether it can use an obscure ethics rule to undermine the special counsel investigation into ties between President Donald Trump’s campaign team and Russia.,0235
000002350002,"President Donald Trump said that Deputy Attorney General Rod Rosenstein’s hiring of former FBI Director Robert Mueller as special counsel to lead the investigation “hurts our country terribly.""",0235
000002360001,James Donovan withdrew his nomination for deputy Treasury secretary.,0236
000002360002,James Donovan withdrew from the position for personal reasons.,0236
000002370001,A current White House official is a significant person of interest in the law enforcement investigation.,0237
000002370002,The White House official is a senior White House adviser who is close to Donald Trump.,0237
000002380001,"President Donald Trump faced ""great pressure because of Russia.""",0238
000002380002,"According to President Donald Trump, firing FBI Director James Comey relieved ""great pressure"" he was facing.",0238
000002390001,"The EPA's grants to state and local governments on pollution issues would be cut by 45 percent, resulting in a total of $597 million.",0239
000002390002,"More than a dozen programs aimed at tackling environmental problems in the Chesapeake Bay, the Great Lakes, and South Florida would be cut entirely.",0239
000002400001,"The U.S. House of Representatives will send its healthcare overhaul plan to the Senate after it receives a final analysis by congressional reviewers, probably in a couple of weeks.",0240
000002400002,The Congressional Budget Office (CBO) is expected to release its analysis of the legislation's costs and impact on health insurance coverage late Wednesday.,0240
000002410001,U.S. President Donald Trump decided to fire FBI chief James Comey before Deputy Attorney General Rod Rosenstein wrote a memo outlining his own concerns.,0241
000002410002,"When it was announced this month that Comey had been fired, White House officials initially pointed to the Rosenstein memo as a reason for firing the FBI director.",0241
000002420001,Gulf states argue they respect human rights within the framework of Islamic Sharia law and conservative societal norms.,0242
000002420002,"Despite their claims, Gulf states have implemented measures that restrict freedom of expression, such as banning political parties, controlling the press, and arresting activists.",0242
000002420003,International organizations have expressed concerns about Gulf states using counter-terrorism legislation to target human rights defenders and writers.,0242
000002430001,The White House said there will be no planned announcement on Friday of U.S. President Donald Trump’s nominee for FBI director.,0243
000002430002,Donald Trump fired former FBI director James Comey on May 9.,0243
000002440001,The Congressional Budget Office expects to release its analysis on May 24th.,0244
000002440002,The Republican-led House passed its healthcare bill earlier this month without a final CBO score.,0244
000002450001,"Three U.S. Democratic Senators raised concerns about President Trump's administration permanently shelving the ""fiduciary rule"".",0245
000002450002,"The ""fiduciary rule"", approved last year under former President Barack Obama, was intended to prevent brokers from recommending inappropriate retirement investments.",0245
000002460001,President Donald Trump will propose $200 billion in infrastructure spending over 10 years.,0246
000002460002,The budget will include details about Trump’s proposals to cut foreign aid and boost military spending.,0246
000002470001,President Trump's upcoming trip will last nine days.,0247
000002470002,"During his campaign, Donald Trump promised to be Israel's ""best friend"" if elected.",0247
000002480001,Trump plans to dedicate a memorial at the new NATO headquarters.,0248
000002480002,"The North Atlantic Treaty Organization invoked the collective defense article, Article 5, only once – after the September 11, 2001, attacks on the United States.",0248
000002490001,Trump expressed a negative sentiment towards Mueller's appointment.,0249
000002490002,Rosenstein appeared anxious and nervous during his briefing to senators.,0249
000002490003,There was tension in the relationship between Trump and Comey.,0249
000002490004,There are suspicions that Trump may have committed obstruction of justice.,0249
000002500001,The overwhelming majority of conservatives and Republicans believe that the current controversies surrounding Donald Trump are driven by media bias and political agendas.,0250
000002500002,77 percent of Republicans approve of Donald Trump's performance.,0250
000002510001,More than a dozen Democratic attorneys general are seeking to intervene in a court case concerning Obamacare subsidy payments.,0251
000002510002,The Republican-led House of Representatives filed the case against the federal government.,0251
000002510003,The attorney general from Kentucky is joining the court filing even as the state's Republican governor has pledged to rollback a Medicaid expansion made possible by Obamacare.,0251
000002520001,Steven Mnuchin has expressed doubts that alternate scoring models will adequately account for the potential for economic growth when assessing the impact of the Trump administration’s tax plan.,0252
000002520002,The Trump administration's tax plan proposes cutting business taxes to 15 percent and simplifying income tax brackets for individuals.,0252
000002520003,"""Any plan we put forward, we believe should be paid for with economic growth,"" said Steven Mnuchin.",0252
000002530001,Senator Sherrod Brown requested Treasury Secretary Steven Mnuchin to produce a list of the Trump family’s business relationships with foreign companies.,0253
000002530002,The Treasury department works with other agencies to address and mitigate potential conflicts of interest if and when they arise.,0253
000002540001,The comptroller position is currently being filled in an acting capacity by Keith Noreika.,0254
000002540002,We actually have someone the president has approved that is going through the FBI vetting process.,0254
