claim_id,claim,document_id
000000860001,National Security Adviser H.R. McMaster stated that back-channeling was normal.,0086
000000860002,"According to H.R. McMaster, back-channel communications allow for discreet communication.",0086
000000870001,FBI investigators are examining whether Russians suggested to Kushner or other Trump aides that relaxing economic sanctions would allow Russian banks to offer financing to people with ties to Trump.,0087
000000870002,"The head of Russian state-owned Vnesheconombank, Sergei Nikolaevich Gorkov, a trained intelligence officer whom Putin appointed, met Kushner at Trump Tower in December. The bank is under U.S. sanctions and was implicated in a 2015 espionage case in which one of its New York executives pleaded guilty to spying and was jailed.  The bank said in a statement in March that it had met with Kushner along with other representatives of U.S. banks and business as part of preparing a new corporate strategy.",0087
000000880001,Donald Trump ended a nine-day overseas journey.,0088
000000880002,Donald Trump flipped traditional U.S. foreign policy upside down on his tour through the Middle East and Europe.,0088
000000880003,"At a Group of Seven summit, Donald Trump refused to maintain U.S. support for the Paris climate agreement.",0088
000000890001,Zbigniew Brzezinski helped found the Trilateral Commission.,0089
000000890002,Brzezinski and Cyrus Vance were rivals for President Carter's attention.,0089
000000890003,Brzezinski favored military action to rescue the American hostages in Iran.,0089
000000890004,Brzezinski supported the SALT-2 arms control accord.,0089
000000900001,President Donald Trump ordered a temporary travel ban on March 6th.,0090
000000900002,"The American Civil Liberties Union (ACLU) represented refugee groups challenging the travel ban, arguing it violated the Constitution.",0090
000000910001,H.R. McMaster said President Donald Trump supports NATO's mutual defense doctrine.,0091
000000910002,"During a visit to Brussels, Donald Trump did not explicitly mention his support for Article 5.",0091
000000920001,Texas Governor Greg Abbott joked about carrying a bullet-pocked target if he saw reporters.,0092
000000920002,"The bill signed by Texas Governor Greg Abbott will reduce the cost of a first-time handgun license from $140 to $40 and lower the renewal fee from $70 to $40, effective in September.",0092
000000930001,Oleg Deripaska offered to testify to congressional panels investigating Russian meddling in the 2016 election.,0093
000000930002,Oleg Deripaska offered to testify in exchange for full immunity from prosecution.,0093
000000940001,The Office of Management and Budget requested a stay of the Office of Government Ethics' request for information on lobbyists working in the administration.,0094
000000940002,"Walter Shaub called the OMB's request ""highly unusual.""",0094
000000950001,The Senate Intelligence Committee is investigating Russian meddling in the US 2016 election.,0095
000000950002,The Senate Intelligence Committee asked Donald Trump's political organization for all documents dating back to the campaign launch in June 2015.,0095
000000960001,President Donald Trump ordered the Interior Department to review 27 national monuments created since 1996.,0096
000000960002,"As of Friday, more than 107,000 comments were received on the national monument review.",0096
000000960003,The public had until May 26 to comment on Bears Ears National Monument.,0096
000000970001,Trump is frustrated with his communications team for not effectively portraying him as uninvolved in the Russia probe.,0097
000000970002,Trump is planning to travel more and hold political rallies.,0097
000000980001,John Boehner has known Donald Trump for 15 years.,0098
000000980002,"John Boehner stated that everything Donald Trump has done besides foreign affairs ""has been a complete disaster.""",0098
000000990001,John F. Kennedy spent his mid-teens at Connecticutâs elite Choate Rosemary Hall.,0099
000000990002,"John F. Kennedy excelled at history and literature but infuriated the school headmaster by organizing pranks as part of a club called ""The Muckers"".",0099
000000990003,John F. Kennedy recounts being shot at after calling an old farmer a bad name.,0099
000001000001,Hillary Clinton criticized a budget proposal that would cut $3.6 trillion in government spending over the next decade.,0100
000001000002,"According to Hillary Clinton, the proposed budget cuts would impact public education, mental health programs, and efforts to combat the opioid epidemic.",0100
000001010001,Greg Gianforte won Montana's seat in the U.S. House of Representatives.,0101
000001010002,Greg Gianforte grabbed Ben Jacobs by the neck with both hands and slammed him to the ground.,0101
000001020001,U.S. Secretary of State Rex Tillerson said that the U.S. government takes full responsibility for the leaks of British police investigation into the Manchester bombing.,0102
000001020002,British police briefly suspended intelligence sharing with the United States after private details of their investigation repeatedly appeared in American media.,0102
000001030001,"Jared Kushner, a senior White House adviser, is under scrutiny by the FBI in the Russia probe.",0103
000001030002,Kushner is being investigated because of his meetings in December and other possible interactions with the Russian ambassador and a banker from Moscow.,0103
000001030003,Several congressional committees are looking into allegations of meddling by Russia in the 2016 U.S. election.,0103
000001040001,A U.S. appeals court refused to reinstate President Donald Trump's travel ban.,0104
000001040002,"Judge Dennis Shedd dissented, stating that ""the real losers in this case are the millions of individual Americans whose security is threatened on a daily basis by those who seek to do us harm.""",0104
000001050001,The United States issued about 50 percent fewer visitor visas in April to citizens of seven countries covered by President Donald Trump's temporary travel bans than it did in an average month last year.,0105
000001050002,The total number of U.S. non-immigrant visas issued to people from all countries was about 15 percent lower in April compared with the 2016 monthly average.,0105
000001060001,Donald Trump accused NATO allies of not spending enough on defense.,0106
000001060002,NATO allies agreed to a target of spending 2 percent of their economic output annually on defense by 2024.,0106
000001070001,A bipartisan group of U.S. senators reintroduced legislation to repeal all restrictions on travel to Cuba.,0107
000001070002,The Freedom to Travel to Cuba Act was introduced in 2015 by eight Republican and Democratic co-sponsors.,0107
000001070003,The latest measure attracted 55 co-sponsors.,0107
000001080001,The last Green Book was issued by the Obama administration in February 2016.,0108
000001080002,"On April 26, the Trump administration released a one-page list of tax proposals summarized in 12 bullet points.",0108
000001090001,The American Civil Liberties Union sued the U.S. Department of Homeland Security on Thursday.,0109
000001090002,"There have been hunger strikes at U.S. Immigration and Customs Enforcement (ICE) detention centers in Georgia, Oregon and Washington in recent weeks.",0109
000001090003,"From April 1-22, an average of 36,235 immigrants were in detention per day.",0109
000001100001,<OUTPUT>U.S. lawmakers introduced legislation on Thursday seeking to stop at least a portion of President Donald Trump's sale of weapons to Saudi Arabia.</OUTPUT>,0110
000001100002,"<OUTPUT>The arms deal includes $110 billion of U.S. arms, with options running as high as $350 billion over 10 years.</OUTPUT>",0110
000001110001,U.S. President Donald Trump arrived in Sicily from Brussels on Thursday.,0111
000001110002,Other leaders are expected to pressure Donald Trump on trade and climate change.,0111
000001120001,The Federal Bureau of Investigation declined to give the House Oversight Committee documents regarding communications between former FBI chief James Comey and President Donald Trump.,0112
000001120002,The House Oversight Committee set a deadline of Wednesday for the FBI's response regarding documents on communications between former FBI chief James Comey and President Donald Trump.,0112
000001130001,Joe Lieberman withdrew his consideration for the position of FBI director.,0113
000001130002,"Joe Lieberman cited a potential conflict of interest due to President Trump hiring Marc Kasowitz, who works at the same firm as Lieberman.",0113
000001140001,President Donald Trump fired James Comey on May 9th.,0114
000001140002,"President Donald Trump was scheduled to interview Joseph Lieberman, Andrew McCabe, Frank Keating, and Richard McFeely for the position of FBI director.",0114
000001150001,Republican and Democratic U.S. congressmen introduced a bill on Thursday that would ban Americans from traveling to North Korea as tourists.,0115
000001150002,At least 17 Americans have been detained in North Korea in the past decade.,0115
000001160001,U.S. President Donald Trump pushed past Prime Minister Dusko Markovic at a NATO summit in Brussels.,0116
000001160002,Montenegro will formally become NATO's 29th state in June.,0116
000001170001,Trump has been clear on his commitment to NATO.,0117
000001170002,President Trump has also been clear in the message to all allies that we have to deliver on the pledge we made to increase defense spending.,0117
000001190001,Donald Trump expressed concern that Americans may lose jobs as a result of Britain leaving the EU in 2019.,0119
000001190002,EU officials said the meeting between Trump and EU leaders was constructive and friendly.,0119
000001200001,"Melania Trump, wife of US President Donald Trump, toured a museum dedicated to Belgian surrealist painter Rene Magritte in Brussels.",0120
000001200002,The museum toured by Melania Trump is dedicated to Belgian surrealist painter Rene Magritte.,0120
000001210001,Each man gripped each other’s right hand so firmly that their knuckles turned white and their jaws seemed to clench.,0121
000001210002,"Macron approached a group of other leaders and made Trump wait, firstly exchanging greetings with Merkel, the head of the Western military bloc, and others.",0121
000001220001,"Donald Trump told Emmanuel Macron, “You were my guy”.",0122
000001220002,Donald Trump told Emmanuel Macron that he did not back Marine Le Pen.,0122
000001230001,Former CIA Director John Brennan warned the head of Russia's FSB security service that Russian interference in the U.S. presidential election would hurt U.S. ties.,0123
000001230002,Published media reports cited Russian attempts to meddle in the 2016 U.S. presidential election.,0123
000001240001,John Brennan testified to the U.S. House of Representatives Intelligence Committee that he had unresolved questions about whether the Russians had been successful in getting U.S. persons to work on their behalf.,0124
000001240002,John Brennan expressed concern about Russian efforts to recruit Americans.,0124
000001250001,"Senator Bob Corker, chairman of the U.S. Senate Foreign Relations Committee, said the panel could take up a bill to impose new sanctions on Russia as soon as this summer.",0125
000001250002,Some Democrats on the Senate Foreign Relations Committee wanted to act more quickly on sanctions over Russian activities.,0125
000001260001,"U.S. President Donald Trump called the Manchester attacks ""savage"" and ""barbaric"".",0126
000001260002,U.S. President Donald Trump said the United States would never stop fighting terrorism.,0126
000001260003,"U.S. President Donald Trump accused low-spending members of the alliance of owing ""massive amounts of money"" to NATO.",0126
000001270001,U.S. Commerce Secretary Wilbur Ross requested a $5.5 million increase for the agency's enforcement budget this year.,0127
000001270002,The Trump Administration requested an additional $4.5 million for the International Trade Administration's enforcement and compliance section.,0127
000001280001,The U.S. Senate Foreign Relations Committee voted 18-3 in favor of the legislation imposing new sanctions on Iran.,0128
000001280002,Lawmakers who supported the bill believed its passage would not violate the terms of the international nuclear agreement with Iran.,0128
000001290001,A senior White House official said that U.S. President Donald Trump stands united with other NATO countries in defending all members of the Western military alliance.,0129
000001290002,NATOâs founding treaty states that an attack on one ally is considered an attack on all allies.,0129
000001300001,Treasury Secretary Steven Mnuchin stated that the Trump administration is hopeful they can find common ground on a bipartisan tax deal.,0130
000001310001,British police stopped sharing information about the Manchester suicide bombing with the United States.,0131
000001310002,U.S. President Trump stated he would seek an official review of leaks and that culprits should be prosecuted.,0131
000001320001,Lewis Lukens condemned media leaks of an investigation into a suicide bomb in Manchester.,0132
000001320002,The U.S. government is launching an investigation into the leaks.,0132
000001320003,Theresa May said she would tell Donald Trump that intelligence shared between their countries had to remain secure.,0132
000001330001,President Donald Trump pledged to donate all profits from overseas governments to the U.S. Treasury.,0133
000001330002,The Trump Organization stated in a pamphlet that it would only donate profits from guests who declare they represent foreign governments.,0133
000001330003,"Seven Democratic lawmakers on the House Judiciary Committee asked President Trump for a detailed account of any benefits or rewards, financial or otherwise, he received from foreign governments since he took office on January 20.",0133
000001340001,Greg Gianforte was cited for a misdemeanor assault.,0134
000001340002,Ben Jacobs accused Greg Gianforte of physical assault.,0134
000001340003,Sheriff Brian Gootkin stated that the nature of the injuries did not meet the statutory elements of felony assault.,0134
000001350001,Greg Gianforte was cited for a misdemeanor on Wednesday.,0135
000001350002,"Ben Jacobs, a reporter for the Guardian, accused Greg Gianforte of physical assault.",0135
000001360001,Senior Russian intelligence and political officials discussed how to influence Donald Trump through his advisers according to information gathered by American spies last summer.,0136
000001360002,"The conversations focused on Paul Manafort, then the Trump presidential campaign chairman, and Michael Flynn, a retired general who was then advising Trump.",0136
000001370001,The House Republicans' bill is projected to leave 24 million more people uninsured compared to Obamacare in 2026.,0137
000001370002,Insurance premiums are projected to fall for younger people in states that do not waive Obamacare requirements.,0137
000001380001,"Mitch McConnell said, ""We have a good relationship.""",0138
000001380002,Mitch McConnell said he and Donald Trump are aligned in putting an overhaul of Obamacare and a rewrite of the tax code at the top of their agenda.,0138
000001390001,The U.S. Treasury is reviewing licenses for Boeing Co and Airbus to sell aircraft to Iran.,0139
000001390002,Steven Mnuchin stated that sanctions were responsible for bringing Iran to the negotiating table ahead of the nuclear deal.,0139
000001400001,"Last summer, U.S. spies learned that Russian officials discussed influencing Donald Trump through his advisers Paul Manafort and Michael Flynn.",0140
000001400002,Russian intelligence and political officials appeared confident that Paul Manafort and Michael Flynn could be used to help shape Donald Trump’s opinions on Russia.,0140
000001410001,Trump has been following a prepared script during his international trip.,0141
000001410002,"Trump has moderated his language, acknowledging the complexity of the Israeli-Palestinian conflict.",0141
000001410003,"Trump's inner circle, including Jared Kushner and Ivanka Trump, played a crucial role in planning and executing the international trip.",0141
000001420001,The House-passed bill would result in 23 million people losing health insurance coverage by 2026.,0142
000001420002,Federal budget deficits would fall by $119 billion over 10 years under the House-passed bill.,0142
000001430001,"U.S. President Donald Trump's bid to slash funding for the United Nations would make it ""impossible"" for it to continue its essential work.",0143
000001430002,"The United States is the biggest U.N. contributor, paying 22 percent of the $5.4 billion core budget and 28.5 percent of the $7.9 billion peacekeeping budget.",0143
000001440001,Mitch McConnell expects bipartisan support for approval of a bill authorizing taxpayer and industry funding for the U.S. Food and Drug Administration.,0144
000001440002,The FDA has been charging companies to review their products since 1992.,0144
000001450001,Vermont Governor Phil Scott vetoed a bill to legalize recreational marijuana.,0145
000001450002,Vermont's House of Representatives approved the bill 79-66 and the state Senate approved it 20-9.,0145
000001450003,Vermont would have been the first state to legalize recreational marijuana through legislation.,0145
000001460001,Carter Page will testify on June 6 before a House committee investigating alleged efforts by Russia to influence the U.S. election.,0146
000001460002,"Carter Page wrote a letter to the leaders of the House Intelligence Committee's investigation stating that previous witnesses presented ""one biased viewpoint"".",0146
000001470001,Senior U.S. lawmakers want the House of Representatives to formally condemn Turkish security forces for their violent response during a protest.,0147
000001470002,The senior U.S. lawmakers are seeking a formal condemnation of the violence directed towards peaceful protesters by Turkish security forces.,0147
000001480001,The White House proposed selling off half of the U.S. emergency crude oil stockpile to help balance the budget.,0148
000001480002,The plan aims to raise nearly \$1.9 billion over ten years.,0148
000001480003,Lawmakers expressed concerns that releasing oil from the SPR could dampen crude prices and hurt drilling companies.,0148
000001490001,Pope Francis urged US President Donald Trump to be a peacemaker at their meeting.,0149
000001490002,Pope Francis gave Trump a small sculptured olive tree symbolizing peace.,0149
000001490003,"Pope Francis gave Trump a signed copy of his 2017 peace message titled ""Nonviolence - A Style of Politics for Peace"".",0149
000001500001,President Donald Trump hired Marc Kasowitz as his private attorney.,0150
000001500002,Kasowitz has represented Trump for more than 15 years.,0150
000001500003,Trump settled the claims against Trump University for $25 million.,0150
000001510001,Democrats on the U.S. House Financial Services Committee requested information from Deutsche Bank CEO John Cryan about internal reviews of Donald Trump's loans.,0151
000001510002,"A Russian ""mirror trading"" scheme allowed $10 billion to flow out of Russia.",0151
000001520001,U.S. House Speaker Paul Ryan stated that Republicans will be able to push through tax reform by the end of this year.,0152
000001520002,Paul Ryan stated that he could envision a scenario where tax reform passes the House of Representatives without including a border adjustment tax.,0152
000001530001,"On Wednesday, Paul Ryan called on health insurance companies to ""stick it out"" in the Obamacare marketplace despite concerns over its stability.",0153
000001530002,There is ongoing litigation over the fate of the Obamacare cost-sharing subsidies.,0153
000001540001,The Texas House of Representatives gave preliminary approval on Tuesday to a new bill on showing identification when voting.,0154
000001540002,The previous voter ID law was struck down by U.S. courts which said it discriminated against black and Hispanic people.,0154
000001550001,President Trump requested to cut defense spending by $54 billion.,0155
000001550002,There is a proposed $1.6 billion down payment to begin building a wall along the US-Mexico border.,0155
000001560001,Ariana Grande returned to the United States on Tuesday.,0156
000001560002,"23-year-old Ariana Grande arrived at an airport in Boca Raton, Florida.",0156
000001560003,"A suicide bomber killed 22 people at Ariana Grande's concert in Manchester, England.",0156
000001570001,Russia tried to recruit Americans during the presidential campaign.,0157
000001570002,Individuals can unintentionally help the Russian cause.,0157
000001570003,"Brennan saw information suggesting potential collusion between Trump and Russian actors, warranting FBI investigation.",0157
000001570004,Trump's campaign advisors had contacts with Russian officials and individuals connected to the Kremlin.,0157
000001570005,Flynn was forced to resign due to his failure to disclose content of conversations with Sergei Kislyak.,0157
000001580001,The White House official stated there is no evidence of any Russia-Trump campaign collusion.,0158
000001580002,Former CIA director John Brennan was aware of contacts between Russian officials and people involved in the Trump campaign.,0158
000001590001,The package would raise income tax from 3.75 percent to 4.95 percent and corporate tax from 5.25 percent to 7 percent.,0159
000001590002,"The income tax hike would generate an estimated $4.4 billion annually, and the corporate income tax increase would generate around $514 million annually.",0159
000001600001,"Trump's proposed budget cuts $800 billion from the Medicaid healthcare plan, impacting states like West Virginia, Arkansas, and Kentucky.",0160
000001600002,"There are differing opinions on the proposed budget cuts, with some Republicans supporting them due to concerns about food stamp eligibility, while others criticize their impact on low-income individuals and public investments.",0160
000001610001,Senator Lindsey Graham opposes President Trump's proposed cuts in the diplomatic and foreign aid budget.,0161
000001610002,President Trump's budget proposal would reduce U.S. funding for global health programs by approximately 25 percent.,0161
000001610003,The Trump budget proposal includes a steep cut to funding for international organizations but does not specify which groups might lose their funding.,0161
000001620001,Flynn's attorney stated that Flynn declined to comply with the subpoena for documents.,0162
000001620002,The Senate Intelligence Committee issued a subpoena for Flynn to provide documents related to their investigation of possible Russian interference in the 2016 U.S. election and whether there was collusion between Trump's campaign and Russia.,0162
000001630001,Donald Trump is seeking a $52 billion hike for the Pentagon.,0163
000001630002,"The Pentagon’s specific defense request is for $574.5 billion, an increase of 4.6 percent compared with the budget for fiscal year 2017.",0163
000001630003,The proposal includes an additional $65 billion in Overseas Contingency Operations (OCO) money.,0163
000001640001,The Trump administration wants to allow states to expand the use of tolling on interstate highways.,0164
000001640002,The Trump administration proposes sharply cutting grants for transit projects.,0164
000001650001,President Trump's 2018 budget proposal seeks to drastically reduce US foreign aid spending.,0165
000001650002,The proposed 2018 Mexican aid of $87.66 million represents a decrease of more than 45 percent from the 2016 outlay.,0165
000001660001,President Donald Trump proposed slashing agriculture spending.,0166
000001660002,The White House proposed $46.54 billion in cuts to federal government funding for the agriculture sector over the next 10 years.,0166
000001660003,"The budget proposal could lead to the elimination of 5,263 jobs at the USDA if implemented.",0166
000001670001,President Donald Trump made a historic visit to Jerusalem's Western Wall on Monday.,0167
000001670002,"Rabbi Shmuel Rabinowitz, Rabbi of the Western Wall, recited two psalms with President Trump.",0167
000001680001,"The Texas House of Representatives approved a bill requiring public school students to use bathrooms, changing facilities and locker rooms that match their biological sex.",0168
000001680002,Critics said the House and Senate versions of the bill undermined civil rights and used children as political pawns.,0168
000001690001,Representative Tom MacArthur resigned as co-chairman of the Tuesday Group.,0169
000001690002,Tom MacArthur resigned as co-chairman of the Tuesday Group due to divisions over efforts to overhaul the nation’s healthcare system.,0169
000001690003,"More than half of the Republican ""no"" votes for the House's Obamacare replacement legislation came from Tuesday Group members.",0169
000001700001,The Commodity Futures Trading Commission is seeking a $31.5 million boost on its current $250 million budget.,0170
000001700002,The White House proposed to keep the budgets of both the CFTC and the Securities and Exchange Commission flat.,0170
000001710001,The U.S. Northeast Gasoline Supply Reserve (NGSR) was established in 2014 to minimize the impact of sudden supply interruptions.,0171
000001710002,"The Northeast Gasoline Supply Reserve (NGSR) consists of 1 million barrels of gasoline blendstock and is stored in commercial storage terminals in Maine, Massachusetts, and New Jersey.",0171
000001710003,The NGSR has not been utilized.,0171
000001720001,The White House projects savings of $35 billion over a decade by rolling back regulations governing Wall Street.,0172
000001720002,The Congressional Budget Office (CBO) estimated that $24 billion would be saved over a decade if a broad Dodd-Frank rollback bill currently in the House of Representatives were passed.,0172
