id1,id2,relation,response
00040001,00150001,1,"Claim 1: Elon Musk stated: ""Climate change is real. Leaving Paris is not good for America or the world.""  Claim 2: Italy, France and Germany said on Thursday they regretted U.S. President Donald Trump’s decision to withdraw from the Paris climate accord and dismissed his suggestion that the global pact could be revised.  Explanation: <thinking>Let's analyze how both statements relate to the Paris Agreement and its withdrawal.</thinking> <step>1. Identify core message of Claim 1: Musk believes in climate change and opposes leaving Paris Agreement</step> <count>19</count> <step>2. Identify core message of Claim 2: European countries regret U.S. withdrawal from Paris Agreement, disagree with Trump's revision suggestion</step> <count>18</count> <step>3. Analyze common ground: Both statements address the negative impact of U.S. withdrawal from the Paris Agreement</step> <count>17</count>  <reflection>Both claims express disapproval of the U.S. withdrawal, indicating a shared stance.  While Musk focuses on broader consequences, European countries highlight their direct reaction.</reflection>  <reward>0.96</reward>  Output: 1"
00010001,00300003,1,"Claim 1: President Donald Trump on Thursday said he would withdraw the United States from the landmark 2015 global agreement to fight climate change.  Claim 2: The Group of Seven summit in Italy revealed a clear split between Trump and the other leaders over honoring the 2015 agreement.  Explanation: <thinking>Let's analyze the relationship between these claims regarding the Paris Agreement.</thinking>  <step>1. Identify subject matter: Both claims involve the 2015 climate agreement and differing stances on it.</step> <count>19</count>  <step>2. Analyze Claim 1: States Trump's intention to withdraw the U.S. from the agreement.</step> <count>18</count>  <step>3. Analyze Claim 2: States a division of opinion among G7 leaders regarding upholding the agreement, implying disagreement with Trump.</step> <count>17</count>  <step>4. Determine relationship: While not explicitly stating opposition to Trump's decision, Claim 2 suggests conflict and differing viewpoints directly related to his announcement in Claim 1.</step> <count>16</count>  <reflection>Both claims address the same issue—the Paris Agreement—with Claim 2 highlighting contrasting positions arising from Trump's declaration in Claim 1. This indicates a relationship of indirect support.</reflection> <reward>0.96</reward>  Output: 1"
00010002,05780001,1,"Claim 1: Trump, tapping into the ""America First"" message he used when he was elected president last year, said the Paris accord would undermine the U.S. economy, cost U.S. jobs, weaken American national sovereignty and put the country at a permanent disadvantage to other nations.  Claim 2: President Trump declined to endorse the Paris Climate Agreement at the G7 summit.  <thinking>Let's break down the content of each claim and see if there's a relationship.</thinking>  <step>1. Analyze Claim 1: States reasons behind Trump's potential opposition to the Paris Agreement, focusing on economic and national security concerns.</step> <count>19</count>  <step>2. Analyze Claim 2: Presents a direct action by Trump – declining to endorse the Paris Agreement at the G7 summit.</step> <count>18</count>  <step>3. Compare actions and stated reasons: Claim 1 provides context for Trump's potential position, while Claim 2 shows his actual action aligning with those stated concerns.</step> <count>17</count>  <reflection>Both claims address the same topic – Trump's stance on the Paris Agreement. Claim 1 explains his reasoning, and Claim 2 demonstrates his actions consistent with those reasons. This indicates a degree of support.</reflection>  <reward>0.96</reward>  Output: 1"
00130001,00610001,1,"Claim 1: U.S. President Donald Trump spoke by phone to German Chancellor Angela Merkel, French President Emmanuel Macron, Canadian Prime Minister Justin Trudeau and British Prime Minister Theresa May to explain his decision to withdraw from the Paris climate accord on Thursday.  Claim 2: Europe must make clear to the United States that quitting the Paris climate agreement is not a straightforward process.  Explanation: <thinking>Let's analyze the relationship between these statements regarding international diplomacy concerning the Paris Agreement.</thinking>  <step>1. Identify actions in Claim 1: Trump notifying world leaders about withdrawal decision</step> <count>19</count>  <step>2. Analyze Claim 2: Europe issuing a statement about difficulty of U.S. withdrawal</step> <count>18</count>  <step>3. Determine connection: While both statements relate to Paris Agreement withdrawal, Claim 2 is a response/reaction to the situation described in Claim 1.</step> <count>17</count>  <reflection>Claims are indirectly related. Claim 2 appears as a consequence or reaction to the actions outlined in Claim 1. </reflection>  <reward>0.91</reward>  Output: 1"
00090001,04330003,1,"Claim 1: President Donald Trump explained his decision to withdraw the United States from the Paris climate accord to German Chancellor Angela Merkel, French President Emmanuel Macron, Canadian Prime Minister Justin Trudeau, and British Prime Minister Theresa May.  Claim 2: The originally planned meeting for Tuesday was meant to lay the groundwork for a formal proposal before Trump announced his decision at the end of May G7 summit.  Explanation: <thinking>Let's analyze the statements regarding their connection.</thinking> <step>1. Identify subjects in each claim: Claim 1 about Trump informing world leaders; Claim 2 about a planned meeting and later decision</step> <count>19</count> <step>2. Analyze timeframes: Both claims touch upon events surrounding Trump's Paris Agreement decision, though with different timelines</step> <count>18</count>  <step>3. Evaluate relationship: While Claim 1 describes the aftermath (Trump informing leaders) and Claim 2 the pre-decision meeting, they both relate to the same event - Trump's withdrawal from Paris Agreement.</step> <count>17</count>   <reflection>Claim 1 focuses on communication after the decision, while Claim 2 is about pre-decision planning. Despite different focuses, both deal with actions surrounding the withdrawal. </reflection> <reward>0.96</reward>  Output: 1"
00030002,01360001,1,Claim 1: Comey's testimony is part of the Senate Intelligence Committee's probe into alleged Russian meddling in the U.S. presidential election and possible collusion with President Donald Trump's campaign. Claim 2: Senior Russian intelligence and political officials discussed how to influence Donald Trump through his advisers.  Explanation: <thinking>Let's analyze the connection between these claims.</thinking>  <step>1. Identify Claim 1 focus: Investigation into alleged Russian interference and potential collusion with Trump campaign</step> <count>19</count>  <step>2. Analyze Claim 2 content: Discussing influence tactics on Trump by Russian officials</step> <count>18</count>  <step>3. Evaluate relationship: Claim 2 presents potential evidence relevant to the investigation outlined in Claim 1 </step> <count>17</count>  <reflection>Claims are related because Claim 2 potentially provides evidence for the issues being investigated in Claim 1.</reflection> <reward>0.96</reward>   Output: 1
00070001,07220001,-1,"Claim 1: Removing the United States from the Paris Climate Agreement is a reckless and indefensible action. It undermines America’s standing in the world and threatens to damage humanity’s ability to solve the climate crisis in time. But make no mistake: if President Trump won’t lead, the American people will.  Claim 2: The President of the United States did what Barack Obama didn't have the nerve to do!  <thinking>Let's analyze the core message of each claim.</thinking>  <step>1. Claim 1 condemns U.S. withdrawal from Paris Agreement, citing negative consequences</step> <count>19</count>  <step>2. Claim 2 implies President Trump took a bold action (impliedly withdrawing from the agreement) that Obama lacked courage to do</step> <count>18</count>  <step>3. Connect implicit action in Claim 2 to criticism in Claim 1: Both relate to U.S. withdrawal, though Claim 2 frames it positively while Claim 1 is negative.</step> <count>17</count>  <reflection>While not explicitly stating the same thing, both claims revolve around the US leaving the Paris Agreement. One condemns it, the other praises it as a bold move.</reflection>  <reward>0.96</reward>  Output: -1"
00470001,07110001,1,"Claim 1: President Donald Trump urged lawmakers to hear from his former advisor Carter Page to counter testimony by directors of the FBI and CIA during congressional investigations into Russia.  Claim 2: Donald Trump tweeted, ""James Comey better hope that there are no  tapes  of our conversations before he starts leaking to the press!""  Explanation: <thinking>Let's analyze the connections between these claims.</thinking>  <step>1. Identify subjects: Claim 1 about Trump's influence on congressional investigation; Claim 2 about Trump's tweet referencing potential recordings</step> <count>19</count>  <step>2. Analyze context: Both claims relate to Congressional investigations into Russia, a shared focus</step> <count>18</count>  <step>3.  Consider indirect relationship: While not directly supporting each other, both actions (urging testimony and tweeting about recordings) could be part of Trump's strategy during the investigation. </step> <count>17</count>   <reflection>While separate actions, the context suggests a potential shared purpose in relation to the Russia investigation.</reflection> <reward>0.88</reward>  Output: 1"
00090001,00200003,-1,"Claim 1: President Donald Trump explained his decision to withdraw the United States from the Paris climate accord to German Chancellor Angela Merkel, French President Emmanuel Macron, Canadian Prime Minister Justin Trudeau, and British Prime Minister Theresa May.  Claim 2: The mayor of Paris stated that the Paris Agreement could not have been secured without the decisive role of the United States of America.   <thinking>Let's analyze the perspectives presented in each claim.</thinking>  <step>1. Identify Claim 1 subject: Trump informing world leaders about US withdrawal from Paris Agreement</step> <count>19</count>  <step>2. Identify Claim 2 subject: Mayor of Paris emphasizing US role in securing the Agreement</step> <count>18</count>  <step>3. Evaluate perspectives: Claims present contrasting viewpoints on US involvement in the Agreement</step> <count>17</count>  <reflection>Claims offer conflicting perspectives: one highlighting withdrawal, the other emphasizing past importance. This suggests indirect contradiction.</reflection> <reward>0.92</reward>  Output: -1"
00000002,03430002,1,"Claim 1: Comey will address the Senate Intelligence Committee in both an open session and behind closed doors.  Claim 2: The briefing will be on President Donald Trump's firing of FBI Director James Comey on Thursday, May 18.  <thinking>Let's analyze if the claims relate to each other.</thinking>  <step>1. Identify subject of Claim 1: Comey's address to Senate Intelligence Committee</step> <count>19</count>  <step>2. Identify subject of Claim 2: Briefing content (Trump firing Comey) on May 18th</step> <count>18</count>  <step>3. Determine connection: Both involve Comey's appearance before Senate Committee, suggesting the briefing topic is related to his address</step> <count>17</count>  <reflection>Claims are likely related; Claim 2 provides context for why Comey is addressing the committee as per Claim 1.</reflection>  <reward>0.96</reward>  Output: 1"
00170003,00280001,1,"Claim 1: Antonio Guterres believes it is crucial that the United States remains a leader on environmental issues and looks forward to engaging with the U.S. government to build a sustainable future for future generations.  Claim 2: A decision by U.S. President Donald Trump to withdraw from the Paris climate agreement would not send a good signal for a separate deal agreed last year that seeks to curb aviation emissions.  Explanation: <thinking>Let's analyze if these statements relate to each other despite seemingly different focuses.</thinking>  <step>1. Identify Claim 1 focus: Emphasizes U.S. leadership in environmental issues and cooperation</step> <count>19</count>  <step>2. Identify Claim 2 focus: Expresses negative consequence of U.S. withdrawal from Paris Agreement on aviation deal</step> <count>18</count>  <step>3.  Establish connection: Both statements concern U.S. environmental policy and its impact, albeit indirectly through different agreements</step> <count>17</count>  <reflection>Claims relate due to shared topic – U.S. environmental actions. Claim 1 supports engagement, while Claim 2 highlights a negative consequence of inaction, implying a connection.</reflection>  <reward>0.92</reward>  Output: 1"
00040001,00080002,1,"Claim 1: Elon Musk stated: ""Climate change is real. Leaving Paris is not good for America or the world.""  Claim 2: Emmanuel Macron stated that U.S. President Donald Trump’s decision to withdraw would harm American interests and citizens.  Explanation: <thinking>Let's break down each statement and their potential connections.</thinking>  <step>1. Analyze Claim 1:  Elon Musk expresses belief in climate change and criticizes the Paris Agreement withdrawal, arguing it harms both America and the world.</step> <count>19</count>  <step>2. Analyze Claim 2: Emmanuel Macron states Trump's decision to withdraw from the Paris Agreement would negatively impact American interests and citizens.</step> <count>18</count>  <step>3. Identify common ground: Both statements address the U.S. withdrawal from the Paris Agreement and its negative consequences.</step> <count>17</count>  <reflection>While expressed differently, both individuals share the view that withdrawing from the agreement is detrimental. This suggests indirect support between the claims.</reflection>  <reward>0.92</reward>  Output: 1"
00000001,02780001,1,"Claim 1: Former FBI Director James Comey will testify next Thursday before a U.S. Senate panel investigating Russia's alleged meddling in the 2016 U.S. election.  Claim 2: Chuck Schumer said that James Comey should still appear before congressional committees.  <thinking>Let's examine the content and potential connections between these claims.</thinking>  <step>1. Identify actions: Claim 1 states Comey's scheduled testimony; Claim 2 expresses Schumer's opinion on Comey appearing</step> <count>19</count>  <step>2. Analyze connection: Both relate to Comey testifying, but Claim 1 describes a specific event while Claim 2 is a broader statement.</step> <count>18</count>  <step>3. Determine relationship type: Claim 2 indirectly supports the event described in Claim 1 by advocating for Comey's appearance.</step> <count>17</count>  <reflection>Claim 2 lends indirect support to Claim 1 as it expresses a desire for the action described in Claim 1 to occur.</reflection>  <reward>0.96</reward>  Output: 1"
00470001,02550001,1,"Claim 1: President Donald Trump urged lawmakers to hear from his former advisor Carter Page to counter testimony by directors of the FBI and CIA during congressional investigations into Russia.  Claim 2: Senator Sherrod Brown asked Treasury Secretary Steven Mnuchin if he was aware of any White House guidance, formal or informal, urging administration officials not to respond to or delay responses to Democratic senators.  Explanation: <thinking>Let's analyze the connections between these claims concerning political actions and investigations.</thinking>  <step>1. Identify subjects: Claim 1 focuses on Trump's involvement in congressional Russia investigations; Claim 2 addresses potential White House interference with Senate inquiries.</step> <count>19</count>  <step>2. Analyze common threads: Both claims involve Congressional investigations and potential influence by the White House, suggesting a related context.</step> <count>18</count>  <step>3. Evaluate direct support: While Claim 2 doesn't explicitly mention Trump or Page, it hints at broader White House strategies potentially impacting investigations like the one involving them.</step> <count>17</count>  <reflection>Claims are related as they both touch upon Congressional investigations and potential White House interference, with Claim 2 hinting at a broader context relevant to Claim 1. While not directly supporting each other, their shared theme warrants considering them connected.</reflection> <reward>0.88</reward>  Output: 1"
00060002,01190003,1,"Claim 1: Trump stated that he was elected to represent Pittsburgh, not Paris, indicating a prioritization of domestic interests over global concerns.  Claim 2: Donald Trump expressed concerns that Brexit could cost U.S. jobs.  Explanation: <thinking>Let's analyze the potential connections between these statements about Trump's stances.</thinking>  <step>1. Identify core themes in each claim: Claim 1 emphasizes domestic focus; Claim 2 highlights concern for U.S. economic impact from a global event (Brexit). </step><count>19</count>  <step>2. Explore potential links: Both statements touch on Trump's views on global events and their ramifications for the U.S., but without direct causal connections.</step><count>18</count>  <step>3. Analyze indirect relationship: While not directly supporting each other, both claims contribute to a broader picture of Trump's perceived prioritization of domestic concerns over international issues. </step><count>17</count>  <reflection>Despite a lack of direct support, the statements share thematic overlap and can be seen as indirectly reinforcing a common perspective on Trump's approach.</reflection><reward>0.88</reward>   Output: 1"
00090002,06000001,1,"Claim 1: Trump also reassured the leaders that America remains committed to the Transatlantic alliance and to robust efforts to protect the environment, according to the White House.  Claim 2: President Trump met with members of NATO for the first time.  <thinking>Let's analyze the context and content of both statements.</thinking>  <step>1. Identify Subject Matter: Claim 1 focuses on Trump's assurances during a meeting; Claim 2 states the occurrence of a first-time meeting.</step> <count>19</count>  <step>2. Determine Relationship:  Claim 2 provides context for Claim 1 by stating that the assurances were given *during* a NATO meeting. </step> <count>18</count>  <step>3. Analyze Support: Claim 2 directly sets the stage for Claim 1, making it logically dependent on the context provided in Claim 2.</step> <count>17</count>  <reflection>Claim 2 provides the setting for Claim 1, thus supporting the statement in Claim 1. </reflection> <reward>0.96</reward>  Output: 1"
00060003,00200002,1,"Claim 1: The debate about whether to stay in or withdraw from the Paris agreement within the White House lasted for several weeks. Claim 2: The mayor of Paris said that President Trump's withdrawal from the climate agreement would have dramatic consequences.  <thinking>Let's analyze the connection between these statements.</thinking>  <step>1. Identify subjects: Claim 1 focuses on internal White House deliberations; Claim 2 on a reaction to an external event (withdrawal)</step> <count>19</count>  <step>2. Analyze relationship: While both touch on the Paris Agreement, Claim 1 describes a process leading up to the withdrawal, while Claim 2 presents a consequence of that withdrawal</step> <count>18</count>  <step>3. Evaluate indirect connection: Claim 1 provides context for the situation addressed in Claim 2; one statement informs understanding of the other</step> <count>17</count>  <reflection>Claims are indirectly related. One describes the lead-up to an event, and the other describes a consequence of that event. </reflection>  <reward>0.88</reward>  Output: 1"
00030002,04940001,1,"Claim 1: Comey's testimony is part of the Senate Intelligence Committee's probe into alleged Russian meddling in the U.S. presidential election and possible collusion with President Donald Trump's campaign.  Claim 2: Russia succeeded in its goals of sowing discord in U.S. politics by meddling in the 2016 presidential election.  Explanation:  <thinking> Let's analyze the connection between Comey's testimony and Russia's alleged interference.</thinking>  <step>1. Identify subjects: Claim 1 focuses on investigation into Russian meddling; Claim 2 asserts Russia's success in meddling.</step> <count>19</count>  <step>2. Determine relationship: Comey's testimony, part of the investigation, aims to uncover evidence related to Russia's meddling as stated in Claim 2.</step> <count>18</count>  <step>3.  Analyze support: While not explicitly stating Russia's success, Claim 1 sets the stage for investigating potential outcomes aligned with Claim 2.</step> <count>17</count>  <reflection> Both claims deal with Russian interference in the election, but Claim 1 focuses on the investigation while Claim 2 presents a conclusion about its impact. However, the investigation's purpose is directly related to verifying the outcome described in Claim 2.</reflection>  <reward>0.96</reward>   Output: 1"
00000001,07330002,1,"Claim 1: Former FBI Director James Comey will testify next Thursday before a U.S. Senate panel investigating Russia's alleged meddling in the 2016 U.S. election.  Claim 2: Kellyanne Conway stated that Trump's decision to fire James Comey was unrelated to the FBI's investigation into Russian interference in the presidential election.  <thinking>Let's examine the connection between Comey's testimony and Conway's statement about his firing.</thinking>  <step>1. Identify subjects: Claim 1 focuses on Comey's upcoming testimony about Russia meddling; Claim 2 discusses Trump's firing of Comey and its alleged motive.</step> <count>19</count>  <step>2. Analyze potential relationship: Comey's testimony is likely to address the FBI's investigation, which Conway claims was unrelated to his firing. </step> <count>18</count>  <step>3. Consider indirect support: Conway's statement attempts to preemptively counter potential accusations that Comey's firing was related to the Russia investigation. This could be seen as indirectly supporting the idea that Comey's testimony will address this issue.</step> <count>17</count>  <reflection>While not a direct statement of support, Conway's claim creates a context where Comey's testimony is more likely to be perceived as relevant to the Russia investigation. </reflection> <reward>0.88</reward>  Output: 1"
00000001,00260001,1,"Claim 1: Former FBI Director James Comey will testify next Thursday before a U.S. Senate panel investigating Russia's alleged meddling in the 2016 U.S. election.  Claim 2: Nigel Farage is a ""person of interest"" in the U.S. investigation into possible collusion between Russia and Donald Trump's presidential campaign.  <thinking>Let's analyze the connections between these claims.</thinking>  <step>1. Identify subjects: Claim 1 focuses on Comey's testimony regarding Russian meddling; Claim 2 mentions Farage as a person of interest in the collusion investigation</step> <count>19</count>  <step>2.  Analyze connection: Both claims relate to investigations into Russian interference in the 2016 election.</step> <count>18</count>  <step>3. Evaluate relationship: While different individuals are involved, both claims contribute to understanding the broader investigation</step> <count>17</count>  <reflection>Claims indirectly support each other by being parts of the same larger investigation. </reflection>  <reward>0.92</reward>  Output: 1"
00470001,02380003,1,"Claim 1: President Donald Trump urged lawmakers to hear from his former advisor Carter Page to counter testimony by directors of the FBI and CIA during congressional investigations into Russia.  Claim 2: According to the New York Times, President Donald Trump stated, ""I faced great pressure because of Russia. That’s taken off,""  Explanation:  <step>1. Identify key subjects in Claim 1: Trump urging Carter Page testimony, countering FBI/CIA directors during Russia investigations</step>\n<count>19</count>  <step>2. Analyze Claim 2: Trump stating he faced pressure from Russia but it's now ""taken off."" This implies relief or lessened scrutiny related to Russia.</step>\n<count>18</count>  <step>3. Evaluate indirect relationship: While not directly supporting Claim 1, Claim 2 hints at a context where Trump felt pressure regarding Russia and sought to counter narratives (potentially aligning with urging Page's testimony).</step>\n<count>17</count>  <reflection>Claims aren't directly contradictory, but Claim 2 provides circumstantial context that *could* be related to Trump's actions described in Claim 1. </reflection>\n<reward>0.85</reward>  Output: 1"
