id1,id2,relation,response
00170001,00640002,1,"Claim 1: The United States' decision to withdraw from the landmark Paris climate agreement was a 'major disappointment for global efforts to reduce greenhouse gas emissions and promote global security,' according to U.N. spokesman Stephane Dujarric.  Claim 2: If the United States withdraws from the Paris climate deal, then we must find partners to continue, because this work must not stop, said Finnish Prime Minister Juha Sipila.  Explanation: <thinking> Let's analyze how these claims relate to each other in terms of factual content and implications.</thinking>  <step>1. Identify subject matter: Both claims address the U.S. withdrawal from the Paris Agreement and its global impact.</step> <count>19</count>  <step>2. Analyze Claim 1's perspective: It presents a negative consequence of withdrawal, emphasizing disappointment and setbacks for global climate efforts.</step> <count>18</count>  <step>3. Analyze Claim 2's perspective: It acknowledges potential withdrawal and proposes a proactive response by finding new partners to continue the work.</step> <count>17</count>  <step>4. Evaluate relationship: While both claims discuss the same event, they present contrasting perspectives - one highlighting negative consequences and the other emphasizing resilience and continuation.</step> <count>16</count>  <reflection>Both claims address the U.S. withdrawal but offer distinct viewpoints. Claim 1 focuses on the setback, while Claim 2 proposes a forward-looking solution. This suggests indirect support as they both contribute to a comprehensive understanding of the situation.</reflection> <reward>0.85</reward>  Output: 1"
00040001,00320001,1,"Claim 1: Elon Musk stated: ""Climate change is real. Leaving Paris is not good for America or the world.""  Claim 2: The Vatican strongly supports the Paris climate change deal.  Explanation: <thinking>Let's analyze the stances expressed in both claims regarding the Paris Agreement.</thinking>  <step>1. Identify core positions: Claim 1 criticizes leaving the Paris Agreement; Claim 2 expresses support for it.</step> <count>19</count>  <step>2. Analyze alignment: Both statements demonstrate agreement on the importance of addressing climate change, albeit from different angles.</step> <count>18</count>  <step>3. Determine relationship: While not directly supporting each other, both claims indirectly support a common goal of climate action.</step> <count>17</count>  <reflection>Claims share a common objective despite differing viewpoints on specific actions. This indirect support warrants considering them as related.</reflection>  <reward>0.96</reward>  Output: 1"
00270003,00280003,1,"Claim 1: U.S. President Donald Trump will announce later on Thursday his decision on whether to keep the United States in the landmark global pact to fight climate change. Claim 2: ""Any decision to withdraw from the Paris agreement by the U.S. is not sending a good signal, even if the U.S. could remain in CORSIA and withdraw from the Paris agreement. But itâs not decided and the two are completely separate,"" IATA director general Alexandre de Juniac said on Thursday.  Explanation:  <step>1. Identify subjects: Claim 1 about Trump's impending decision; Claim 2 discusses potential withdrawal implications and separation from CORSIA</step>\n<count>19</count>  <step>2. Analyze connection: Both statements refer to the Paris Agreement, but Claim 1 focuses on the imminent decision while Claim 2 offers an opinion on the potential consequences of withdrawal.</step>\n<count>18</count>  <step>3. Evaluate relationship: While both relate to the same topic, Claim 2 reacts to a possible outcome mentioned in Claim 1, creating indirect support through commentary.</step>\n<count>17</count>  <reflection>Claims indirectly support each other; one sets the context (decision) and the other offers an opinion based on that potential action. </reflection>\n<reward>0.92</reward>  Output: 1"
00040001,00100002,1,"Claim 1: Elon Musk stated: ""Climate change is real. Leaving Paris is not good for America or the world."" Claim 2: The United Kingdom remains committed to the Paris Agreement.  <thinking>Let's analyze the stances on the Paris Agreement presented in both claims.</thinking>  <step>1. Identify Claim 1 stance: Musk opposes leaving the agreement, implying support for it.</step> <count>19</count>  <step>2. Identify Claim 2 stance: UK reaffirms its commitment to the agreement.</step> <count>18</count>  <step>3. Compare stances: Both claims express support for the Paris Agreement, albeit indirectly in Musk's case.</step> <count>17</count>  <reflection>Both statements align in supporting the Paris Agreement, even if through different expressions.</reflection>  <reward>0.96</reward>  Output: 1"
00970003,02820002,1,"Claim 1: The strategic shake-up is intended to address concerns about the Russia probe's impact on Trump's agenda and his approval ratings.  Claim 2: Senator Cornyn stated the announcement could make it easier for the Senate to confirm President Donald Trump’s replacement of fired FBI Director James Comey.  Explanation: <thinking>Let's break down the connections between these claims.</thinking>  <step>1. Identify key events: Claim 1 mentions a 'strategic shake-up' and its purpose; Claim 2 refers to confirming Comey's replacement</step> <count>19</count>  <step>2. Analyze potential links: Could the 'shake-up' be related to replacing Comey? This is a plausible indirect connection.</step> <count>18</count>  <step>3. Evaluate support: While not explicitly stated, Claim 2 suggests the shake-up *could* facilitate the confirmation process for Comey's replacement, aligning with Claim 1's intent to address concerns related to the Russia probe and Trump's agenda.</step> <count>17</count>  <reflection>There's a potential indirect link based on plausible implications. It's not a direct statement of support but a reasonable inference.</reflection> <reward>0.85</reward>  Output: 1"
00140003,04840002,1,"Claim 1: U.S. Treasury Secretary Steven Mnuchin stated, ""we are very focused on working with them and I'm confident we'll get there before there's an issue.""  Claim 2: The approval was a procedural hurdle cleared ahead of a planned vote on Thursday.  Explanation: <thinking>Let's analyze the context and potential relationships between these statements.</thinking>   <step>1. Identify key actors: Both claims involve Mnuchin and the implied ""them"" likely refers to parties involved in the pending vote</step> <count>19</count>  <step>2. Analyze Mnuchin's statement: Expresses confidence in resolving issues before a problem arises, suggesting a positive outcome desired</step> <count>18</count>  <step>3.  Interpret Claim 2: States a procedural hurdle was overcome, indicating progress towards the planned vote on Thursday</step> <count>17</count>  <step>4. Evaluate connection: While not explicitly stated, Mnuchin's statement implies working towards a successful outcome aligns with clearing the procedural hurdle described in Claim 2 </step> <count>16</count>  <reflection>Both claims touch upon the same process, though indirectly.  Mnuchin's statement suggests a positive goal while Claim 2 describes a step taken towards that goal.</reflection> <reward>0.87</reward>  Output: 1"
00540001,05780002,1,"Claim 1: White House spokesman Sean Spicer said that when President Trump makes a decision on the Paris Accord, he will make an announcement and clarify the basis of it.  Claim 2: German Chancellor Angela Merkel expressed dissatisfaction with discussions about climate change following President Trump's decision.  <thinking>Let's analyze the temporal relationship and content of each statement.</thinking>  <step>1. Identify actions: Claim 1 describes a future announcement; Claim 2 reports Merkel's reaction to a past decision</step> <count>19</count>  <step>2. Analyze temporal sequence:  Claim 2 implies Trump already made a decision, while Claim 1 suggests an upcoming announcement</step> <count>18</count>  <step>3. Evaluate relationship: Merkel's reaction is to a pre-existing action (Trump's decision), making the statements indirectly related</step> <count>17</count>  <reflection>While not directly supporting each other, the claims are connected through the common thread of Trump's Paris Accord decision.</reflection> <reward>0.85</reward>   Output: 1"
00010001,00040003,1,"Claim 1: President Donald Trump on Thursday said he would withdraw the United States from the landmark 2015 global agreement to fight climate change.  Claim 2: Robert Iger resigned from the President’s Council over the #ParisAgreement withdrawal, stating it was “as a matter of principle.”  Explanation: <thinking>Let's analyze the relationship between Trump's withdrawal announcement and Iger's resignation.</thinking>  <step>1. Identify actions: Claim 1 states Trump's withdrawal; Claim 2 describes Iger's resignation</step> <count>19</count>  <step>2. Determine motive:  Claim 2 explicitly links Iger's resignation to the #ParisAgreement withdrawal, citing ""as a matter of principle"".</step> <count>18</count>  <step>3. Analyze relationship: Iger's resignation is a direct consequence of Trump's decision, demonstrating a clear causal link.</step> <count>17</count>  <reflection>Claims are directly related; one action (withdrawal) triggers the other (resignation). </reflection>  <reward>0.98</reward>   Output: 1"
00260001,02720003,1,"Claim 1: Nigel Farage is a ""person of interest"" in the U.S. investigation into possible collusion between Russia and Donald Trump's presidential campaign.  Claim 2: The previously undisclosed interactions are being reviewed by FBI and congressional investigators.  Explanation: <thinking>Let's analyze the relationship between these claims.</thinking>  <step>1. Identify subject of Claim 1: Nigel Farage's involvement in the Russia investigation</step> <count>19</count>  <step>2. Identify subject of Claim 2: Review of undisclosed interactions by FBI and Congress</step> <count>18</count>  <step>3. Analyze connection: Both claims touch upon the same investigation, potentially involving Nigel Farage's interactions</step> <count>17</count>  <reflection>While not explicitly stated, Claim 2 implies the 'undisclosed interactions' could be related to the investigation into Nigel Farage mentioned in Claim 1. </reflection> <reward>0.85</reward>  Output: 1"
00060002,05780001,1,"Claim 1: Trump stated that he was elected to represent Pittsburgh, not Paris, indicating a prioritization of domestic interests over global concerns.  Claim 2: President Trump declined to endorse the Paris Climate Agreement at the G7 summit.  Explanation:   <step>1. Analyze Claim 1: It expresses Trump's stated preference for domestic issues over global ones, using ""Pittsburgh"" vs. ""Paris"" metaphorically.</step> <count>19</count>  <step>2. Analyze Claim 2: States a specific action by Trump - declining to endorse the Paris Agreement - a global climate accord.</step> <count>18</count>  <step>3. Evaluate connection:  Claim 1 provides context for Claim 2.  Trump's stated preference aligns with his action of not endorsing the international agreement. </step> <count>17</count>   <reflection>Both statements relate to Trump's stance on global issues vs. domestic ones. While Claim 1 is more general, Claim 2 demonstrates this stance in action.</reflection> <reward>0.92</reward>  Output: 1"
00970001,05050002,1,"Claim 1: The White House plans to launch a more aggressive effort to combat allegations involving Russia and Trump's presidential campaign following his overseas trip.  Claim 2: Trump and Putin aimed to ease tensions from U.S. air strikes in Syria by discussing a ceasefire and safe zones.  <thinking>Let's analyze the potential connections between these claims.</thinking> <step>1. Identify actions: Claim 1 involves White House response; Claim 2 focuses on Trump-Putin meeting</step> <count>19</count>  <step>2.  Consider context: Both claims relate to post-trip events and Russia/U.S. relations, suggesting potential indirect link</step> <count>18</count>  <step>3. Evaluate connection: Claim 1's ""aggressive effort"" could be a response to perceived outcomes or discussions from the meeting described in Claim 2</step> <count>17</count>  <reflection>While not directly stating causation, there's plausible indirect support - White House action potentially *motivated* by the summit. </reflection> <reward>0.85</reward>    Output: 1"
00200002,00270001,1,"Claim 1: The mayor of Paris said that President Trump's withdrawal from the climate agreement would have dramatic consequences.  Claim 2: German Chancellor Angela Merkel described the Paris climate accord as an “essential pact”.  Explanation: <thinking>Let's analyze how these statements relate to each other concerning the Paris Agreement.</thinking> <step>1. Identify subject matter: Both claims discuss the Paris climate accord and perspectives on its importance</step> <count>19</count>   <step>2.  Analyze Claim 1's implication: The mayor suggests negative consequences from withdrawing, implying value in the agreement itself </step> <count>18</count>  <step>3. Interpret Claim 2: Merkel calls it an ""essential pact,"" directly affirming its value and importance</step> <count>17</count>   <reflection>Both statements indirectly support each other by highlighting the perceived significance of the Paris Agreement. While not a direct endorsement, the mayor's concern about withdrawal aligns with Merkel's positive description.</reflection>  <reward>0.92</reward>  Output: 1"
00160003,01720003,1,"Claim 1: The CBO is one of a handful of analysis units of Congress whose employees strive for political impartiality, providing dependable and neutral information that lawmakers can use when making often complex budget, tax and other decisions.  Claim 2: The Congressional Budget Office (CBO) estimated that $24 billion would be saved over a decade if a broad Dodd-Frank rollback bill were passed.  Explanation: <thinking>Let's analyze the relationship between the claims focusing on factual content.</thinking>  <step>1. Identify Subject of Claim 1: The claim describes the CBO's mission and principles, emphasizing impartiality and providing neutral information for lawmakers.</step>\ <count>19</count>  <step>2. Identify Subject of Claim 2: This claim presents a specific finding by the CBO regarding the potential financial impact of a particular bill (Dodd-Frank rollback).</step>\ <count>18</count>  <step>3. Analyze Connection: Claim 2 demonstrates the CBO fulfilling its stated mission in Claim 1 by providing a neutral analysis with quantifiable data about a policy proposal.</step>\ <count>17</count>  <reflection>Both claims relate to the CBO's role and function. Claim 2 exemplifies how the CBO operates according to the principles outlined in Claim 1.</reflection>  <reward>0.96</reward>  Output: 1"
00970003,06920001,1,"Claim 1: The strategic shake-up is intended to address concerns about the Russia probe's impact on Trump's agenda and his approval ratings.  Claim 2: White House sources have told Infowars that Sean Spicer could be fired within the next week as President Trump begins a purge of establishment advisers who he feels have failed to properly investigate leaks coming from within the administration.  Explanation: <thinking>Let's analyze the connection between these claims about potential personnel changes in the White House.</thinking>  <step>1. Identify overlapping themes: Both claims discuss potential changes to Trump's advisory team and motivations behind them. </step><count>19</count>    <step>2. Analyze Claim 1: Focuses on broader strategic goals (agenda, approval ratings) as reasons for shake-up.</step><count>18</count>  <step>3. Analyze Claim 2: Provides specific example (Sean Spicer firing), ties it to ""investigation of leaks"" and broader removal of ""establishment advisers."" </step><count>17</count>  <step>4. Evaluate Relationship: While both claim changes are linked to Trump, Claim 2 provides a more concrete example falling under the umbrella of concerns addressed in Claim 1. </step><count>16</count>  <reflection>Claim 2 supports Claim 1 by providing a specific action (Spicer firing) that aligns with the broader strategic motivations outlined in Claim 1. The leak investigation is one way to potentially address negative impacts on Trump's agenda and approval ratings.</reflection>  <reward>0.96</reward>   Output: 1"
00560001,02840003,-1,"Claim 1: Former FBI Director James Comey plans to confirm reports that President Donald Trump pressured him to drop an investigation into former national security adviser Michael Flynnâs ties to Russia.  Claim 2: President Trump said, ""A thorough investigation will confirm what we already know - there was no collusion between my campaign and any foreign entity.Â I look forward to this matter concluding quickly.""  Explanation: <thinking>Let's analyze the content of each claim to determine their relationship.</thinking>  <step>1. Identify Claim 1 focus: Allegation of Trump pressuring Comey regarding Flynn investigation</step> <count>19</count>  <step>2.  Identify Claim 2 focus: Trump asserting innocence and expectation of a quick, confirming conclusion to the investigation</step> <count>18</count>  <step>3. Analyze potential connections: Both claims touch on the same investigation but present opposing perspectives</step> <count>17</count>   <reflection>While both claims relate to the same overarching investigation, they present contrasting viewpoints. Claim 1 suggests wrongdoing by Trump, while Claim 2 denies any collusion and anticipates a favorable outcome. This indicates a contradiction rather than support.</reflection>  <reward>0.96</reward>  Output: -1"
00970003,03040002,1,"Claim 1: The strategic shake-up is intended to address concerns about the Russia probe's impact on Trump's agenda and his approval ratings.  Claim 2: ""I hope you can let this go,"" Trump told Comey, according to a source familiar with the contents of the memo.  Explanation: <thinking>Let's examine the connection between these statements.</thinking> <step>1. Analyze Claim 1: It focuses on strategic changes aimed at mitigating negative effects of the Russia probe (on agenda and approval).</step> <count>19</count>  <step>2. Analyze Claim 2: It describes Trump's direct request to Comey to ""let this go,"" suggesting a desire to downplay or end the investigation.</step> <count>18</count>  <step>3. Evaluate Relationship: Both statements touch upon the Russia probe and Trump's actions regarding it. Claim 2 suggests a direct attempt by Trump to influence the investigation, while Claim 1 describes broader strategic responses to its perceived consequences.</step> <count>17</count>  <reflection>While not a direct contradiction, both claims point towards Trump's efforts to manage the Russia probe situation. Claim 1 takes a wider view of its impact, while Claim 2 focuses on a specific interaction. Their combined context suggests indirect support.</reflection>  <reward>0.85</reward>   Output: 1"
00000001,06970001,1,"Claim 1: Former FBI Director James Comey will testify next Thursday before a U.S. Senate panel investigating Russia's alleged meddling in the 2016 U.S. election.  Claim 2: Sarah Huckabee Sanders was the Deputy Press Secretary, fielding questions about the firing of FBI Director James Comey and the Russia investigation.  <thinking> Let's break down the relationship between these claims.</thinking>  <step>1. Identify subjects: Claim 1 focuses on Comey's upcoming testimony; Claim 2 describes Sanders' role in handling press inquiries related to Comey and the Russia investigation.</step> <count>19</count>  <step>2. Analyze connections: Both claims involve James Comey and the Russia investigation, but from different perspectives.  Claim 1 highlights a direct action (Comey's testimony), while Claim 2 describes a reactive role (Sanders responding to inquiries).</step> <count>18</count>  <step>3. Evaluate indirect relationship: While not directly supporting each other, the claims are linked through their shared context: Comey and the Russia investigation. Sanders' actions were likely influenced by Comey's firing and the ongoing investigation.</step> <count>17</count>  <reflection>Both claims touch upon the same broader event, even though they present different aspects. Claim 2 provides background on public communication surrounding events mentioned in Claim 1.</reflection>  <reward>0.88</reward>  Output: 1"
00470001,07150002,1,"Claim 1: President Donald Trump urged lawmakers to hear from his former advisor Carter Page to counter testimony by directors of the FBI and CIA during congressional investigations into Russia.  Claim 2: ""There are very strong allegations that the Russians had relationships with people inside of the Trump campaign,""  Markey said during an interview on CNN.  Explanation: <thinking>Let's analyze the claims for potential support, contradiction or irrelevance.</thinking>  <step>1. Identify subjects: Claim 1 focuses on Trump wanting to include Carter Page in congressional hearings; Claim 2 presents an allegation about Russian connections within the Trump campaign</step> <count>19</count>  <step>2. Analyze potential connection: Both claims relate to the Russia investigations, but Claim 1 is about procedural action (hearing inclusion) while Claim 2 is an accusation. </step> <count>18</count>  <step>3. Consider indirect support:  Claim 2 suggests a motive for Trump's actions in Claim 1 - potentially to counter accusations of Russian connections.</step> <count>17</count>   <reflection>While not directly supporting each other, there's a plausible indirect link based on the context of the Russia investigations. </reflection> <reward>0.85</reward>  Output: 1"
00000001,03660002,1,"Claim 1: Former FBI Director James Comey will testify next Thursday before a U.S. Senate panel investigating Russia's alleged meddling in the 2016 U.S. election.  Claim 2: Republican Chairman Richard Burr and ranking Democrat Mark Warner made the comments to reporters following a meeting with U.S. Deputy Attorney General Rod Rosenstein in the wake of President Donald Trump’s firing of James Comey this week.  Explanation: <thinking> Let's analyze the connections between these statements.</thinking>  <step>1. Identify key events: Claim 1 focuses on Comey's upcoming testimony; Claim 2 describes a meeting and comments after Trump fired Comey</step> <count>19</count>  <step>2.  Look for direct connections: Claim 2 mentions Comey's firing, which is likely the context for his testimony mentioned in Claim 1</step> <count>18</count>  <step>3. Evaluate indirect support: Claim 2 provides background information relevant to understanding the reason behind Comey's testimony in Claim 1</step> <count>17</count>   <reflection>While not directly stating that the testimony is related to Comey's firing, Claim 2 offers contextual information making the connection plausible. </reflection>  <reward>0.85</reward>  Output: 1"
00120002,00960002,1,"Claim 1: ""Today’s decision is a setback for the environment and for the U.S.’s leadership position in the world,""  Claim 2: President Donald Trump ordered the Interior Department to review some 27 national monuments created since 1996.  Explanation: <thinking>Let's analyze the potential connection between these statements.</thinking>  <step>1. Identify Claim 1's subject: Environmental impact and U.S. leadership perception due to a ""decision"".</step> <count>19</count>  <step>2. Identify Claim 2's subject: A presidential order reviewing national monuments, potentially impacting environmental protection.</step> <count>18</count>  <step>3. Analyze potential connection:  Claim 2 describes an action (review of monuments) that *could* lead to consequences addressed in Claim 1 (environmental setback, leadership perception change). </step> <count>17</count>  <reflection> While not a direct contradiction, Claim 2 provides context for the ""decision"" mentioned in Claim 1. It's plausible the review is what prompted the negative assessment in Claim 1.</reflection> <reward>0.88</reward>  Output: 1"
00200002,05890003,1,"Claim 1: The mayor of Paris said that President Trump's withdrawal from the climate agreement would have dramatic consequences.  Claim 2: President Trump reportedly aimed to keep the G7 summit focused on terrorism and trade rather than climate change.  Explanation: <thinking>Let's analyze the statements for potential relationships.</thinking>  <step>1. Identify subjects: Claim 1 about impact of withdrawal; Claim 2 about Trump's G7 agenda</step> <count>19</count>  <step>2.  Examine connections: Both statements relate to President Trump's actions/priorities concerning global issues.</step> <count>18</count>  <step>3. Analyze indirect support: Claim 2 suggests Trump prioritized issues other than climate change, potentially aligning with the mayor's concerns about consequences from withdrawal (Claim 1).</step> <count>17</count>  <reflection>While not a direct contradiction or explicit support, Claim 2 provides context that indirectly strengthens Claim 1. </reflection> <reward>0.88</reward>  Output: 1"
