id1,id2,relation,response
00060003,01950002,1,"Claim 1: The debate about whether to stay in or withdraw from the Paris agreement within the White House lasted for several weeks.  Claim 2: The administration and Republican lawmakers cited discussions on measures that might eliminate the need for a court decision, such as new healthcare legislation, as the reason for the delay.  Explanation:  <step>1. Identify core concepts: Claim 1 about debate duration; Claim 2 about reasons for delay</step> <count>19</count> <step>2. Analyze connection: Claim 2 suggests factors influencing the debate's length (delay).</step> <count>18</count> <step>3. Determine relationship: Claim 2 provides context explaining Claim 1.</step> <count>17</count>  <reflection>Claims are related as Claim 2 offers an explanation for the situation described in Claim 1. </reflection>  <reward>0.96</reward>   Output: 1"
00200001,00640002,1,"Claim 1: The mayor of Paris said that U.S. President Donald Trump's withdrawal from the climate agreement was a mistake.  Claim 2: If the United States withdraws from the Paris climate deal, then we must find partners to continue, because this work must not stop, said Finnish Prime Minister Juha Sipila.  Explanation: <thinking>Let's examine the statements and their potential connections.</thinking>  <step>1. Analyze Claim 1: Expresses disapproval of US withdrawal from the climate agreement by a Paris official</step> <count>19</count>  <step>2. Analyze Claim 2:  States a plan to continue climate work despite potential US withdrawal, emphasizing partnership</step> <count>18</count>  <step>3. Identify Common Ground: Both statements relate to the Paris climate agreement and US withdrawal from it.</step> <count>17</count>  <reflection>While Claim 1 expresses disapproval and Claim 2 proposes a continuation plan, both focus on the same event (US withdrawal)  and indirectly support each other by acknowledging its impact. </reflection>   <reward>0.85</reward>  Output: 1"
00470001,03880003,1,"Claim 1: President Donald Trump urged lawmakers to hear from his former advisor Carter Page to counter testimony by directors of the FBI and CIA during congressional investigations into Russia.  Claim 2: Comey's refusal to preview his testimony was considered an act of insubordination by Trump and his aides.  Explanation: <thinking>Let's analyze the relationship between these statements, focusing on factual content.</thinking>  <step>1. Identify subjects: Claim 1 about Trump's call for hearing Carter Page; Claim 2 about Comey's testimony preview refusal</step> <count>19</count>  <step>2. Determine connections: Both claims relate to congressional investigations into Russia and Trump's reaction/actions within those investigations</step> <count>18</count>  <step>3. Analyze indirect support: While not directly supporting each other, both statements reflect Trump's involvement in shaping the narrative of the Russia investigation through his actions and preferences </step> <count>17</count>  <reflection>Claims indirectly support each other by highlighting aspects of Trump's approach to congressional investigations into Russia.</reflection>  <reward>0.89</reward>  Output: 1"
00130001,07930002,1,"Claim 1: U.S. President Donald Trump spoke by phone to German Chancellor Angela Merkel, French President Emmanuel Macron, Canadian Prime Minister Justin Trudeau and British Prime Minister Theresa May to explain his decision to withdraw from the Paris climate accord on Thursday.  Claim 2: The discussion involved global warming.  Explanation:   <step>1. Identify subjects: Claim 1 focuses on phone calls regarding Paris Agreement withdrawal; Claim 2 states topic of discussion was global warming</step> <count>19</count>  <step>2. Analyze connection:  Phone call purpose (explaining withdrawal) directly relates to the topic of global warming, as the Paris Agreement addresses climate change</step> <count>18</count>  <step>3. Evaluate relationship: Both claims point towards same subject matter - the context surrounding Trump's decision on the Paris Agreement and its connection to global warming</step> <count>17</count>   <reflection>Claims directly relate as the phone call was about withdrawing from an agreement concerning global warming. </reflection> <reward>0.98</reward>  Output: 1"
00140003,01270002,1,"Claim 1: U.S. Treasury Secretary Steven Mnuchin stated, ""we are very focused on working with them and I'm confident we'll get there before there's an issue.""  Claim 2: The requested funds will be used to crack down on unfair trade practices and export security violations.  Explanation: <thinking> Let's break down the statements to see if there's a connection. </thinking> <step>1. Identify actions in Claim 1: Mnuchin mentions ""working with them"" and being ""confident we'll get there."" This implies negotiation or cooperation on some issue.</step> <count>19</count>  <step>2. Analyze Claim 2: It states the funds' purpose is to address unfair trade practices and export security violations. </step> <count>18</count>  <step>3. Consider potential link:  The actions in Claim 1 could be related to resolving issues causing unfair trade or export violations. </step> <count>17</count>  <reflection> While not explicitly stated, there's a possibility that the ""working with them"" and resolving an issue in Claim 1 refers to the situation outlined in Claim 2. It's not a direct support but a potential indirect connection based on the content.</reflection> <reward>0.85</reward>  Output: 1"
00070002,03390001,-1,"Claim 1: President Trump acted in America’s best interest, moving away from a flawed agreement ... and opening the door to a new agreement that reaches the right balance. America will remain a leader in environmental protection. But we will not jeopardize our economy in order to please other countries that don’t come anywhere near our environmental standards.  Claim 2: Dick Durbin, the U.S. Senate’s number two Democrat, said President Trump’s conduct was “not only dangerous, it’s reckless.”  Explanation:   <step>1. Identify Claim 1's stance: Supports Trump's decision to withdraw from the agreement, framing it as beneficial for America</step> <count>19</count>  <step>2. Analyze Claim 2:  Provides a contrasting opinion, deeming Trump's actions ""dangerous"" and ""reckless""</step> <count>18</count>  <step>3. Determine relationship: Claims express opposing viewpoints on the same subject (Trump's withdrawal)</step> <count>17</count>  <reflection>Claims directly contradict each other regarding the implications of Trump's actions.</reflection> <reward>0.98</reward>  Output: -1"
00440001,03510002,1,"Claim 1: A political dispute erupted over House Intelligence Committee subpoenas.  Claim 2: The records are needed for an investigation into possible ties between Russia and President Donald Trump and his associates.  Explanation: <thinking>Let's analyze the connection between the two statements.</thinking>  <step>1. Identify key elements in Claim 1: ""Political dispute,"" ""House Intelligence Committee subpoenas"".</step> <count>19</count>  <step>2. Identify key elements in Claim 2: ""Investigation,"" ""Russia ties,"" ""President Donald Trump and his associates."" </step> <count>18</count>  <step>3.  Consider potential relationship: Subpoenas are often used to gather evidence for investigations. The investigation mentioned in Claim 2 *could* be the subject of the political dispute in Claim 1.</step> <count>17</count>  <reflection> While not explicitly stated, the context suggests a plausible connection.  The subpoenas might be related to the investigation described in Claim 2, leading to the political dispute. </reflection> <reward>0.85</reward>   Output: 1"
00880003,04150003,1,"Claim 1: Trump's overseas journey took place amidst troubles facing him back home.  Claim 2: An investigation was underway into the possibility of collusion between the Trump 2016 presidential campaign and Russia to influence the election outcome.  Explanation: <thinking>Let's analyze the connections between these claims.</thinking>   <step>1. Identify Claim 1 subject: Trump's overseas trip happening during a period of difficulties in the U.S.</step> <count>19</count>  <step>2. Identify Claim 2 subject: An investigation into potential collusion between the Trump campaign and Russia.</step> <count>18</count>  <step>3. Determine relationship: The investigation could be considered one of the ""troubles"" facing Trump back home mentioned in Claim 1. </step> <count>17</count>  <reflection>While not explicitly stated, the investigation aligns with the context of difficulties described in Claim 1.  The claims indirectly support each other.</reflection>   <reward>0.85</reward>  Output: 1"
00440001,04240002,1,"Claim 1: A political dispute erupted over House Intelligence Committee subpoenas. Claim 2: Former Director of National Intelligence James Clapper said he could not comment on Russian ties to Trump’s business interests because the issue could be a subject of an ongoing investigation.  <thinking>Let's examine the connection between these statements.</thinking>  <step>1. Identify subjects: Claim 1 deals with subpoenas & political dispute; Claim 2 focuses on Clapper's statement regarding potential investigation</step> <count>19</count>  <step>2. Analyze potential links: Could subpoenas relate to investigation mentioned by Clapper? </step> <count>18</count>  <step>3. Consider indirect support: Subpoenas could be part of an investigation into Russian ties, making statements indirectly related</step> <count>17</count>  <reflection>While not explicitly stated, there's a possibility that subpoenas are connected to the investigation Clapper mentions. This suggests an indirect relationship.</reflection> <reward>0.85</reward>  Output: 1"
00000003,06470003,1,"Claim 1: Comey was leading the FBI’s probe into the allegations, and his firing sparked a political uproar.  Claim 2: On Wednesday, DOJ appointed a special prosecutor, former FBI Director Robert Mueller, to drum up more hype about Trump s imaginary  collusion  with Russia during the general election.  Explanation: <thinking>Let's analyze the relationship between these claims concerning investigations and political responses.</thinking>  <step>1. Identify central subjects: Claim 1 focuses on Comey's leadership of an FBI probe & its aftermath; Claim 2 discusses a special prosecutor appointment related to potential collusion.</step> <count>19</count>  <step>2. Determine overlap: Both claims involve investigations into alleged Trump-Russia collusion, albeit at different stages and with distinct actors.</step> <count>18</count>  <step>3. Analyze implications: Claim 2 suggests the appointment was a response to the initial investigation (Comey's probe) but casts it in a potentially negative light (""drum up hype""). This indirect connection is suggestive of a link between the two events.</step> <count>17</count>  <reflection>While not directly stating support, Claim 2 implies a reaction to the situation established by Claim 1. The language used suggests a critical stance towards the special prosecutor's appointment, but the connection remains indirect.</reflection> <reward>0.88</reward>  Output: 1"
00030002,07330002,1,"Claim 1: Comey's testimony is part of the Senate Intelligence Committee's probe into alleged Russian meddling in the U.S. presidential election and possible collusion with President Donald Trump's campaign.  Claim 2: Kellyanne Conway stated that Trump's decision to fire James Comey was unrelated to the FBI's investigation into Russian interference in the presidential election.  Explanation: <thinking>Let's analyze the connection between these claims, focusing on factual content.</thinking>  <step>1. Identify subjects: Claim 1 concerns Comey's testimony within a Senate investigation; Claim 2 addresses Conway's statement about Comey's firing and its motive</step> <count>19</count>  <step>2. Evaluate relationship: Both claims touch upon the same broader context: investigations into Russian interference and Trump's campaign. </step> <count>18</count>  <step>3. Analyze indirect connection: Claim 2 (Conway's statement) offers a potential explanation for Comey's firing, which may indirectly influence the Senate investigation outlined in Claim 1.</step> <count>17</count>  <reflection>While not directly stating support or contradiction, Claim 2 provides context that could impact the events described in Claim 1. This indirect relationship warrants further consideration.</reflection>  <reward>0.85</reward>    Output: 1"
00180001,00500003,-1,"Claim 1: French President Emmanuel Macron told U.S. President Donald Trump that the Paris climate deal could not be renegotiated.  Claim 2: Trump will honor a campaign pledge to pull out of the Paris Agreement and tweeted he would announce his formal decision ""over the next few days.""  Explanation: <thinking>Let's analyze the implications of each statement and their potential relationship.</thinking>  <step>1. Identify actions: Claim 1 describes Macron's stance; Claim 2 outlines Trump's planned action</step> <count>19</count>  <step>2. Analyze motivations: Both statements relate to the Paris Agreement, but with opposing stances</step> <count>18</count>  <step>3. Evaluate connection: Macron opposes renegotiation, implying Trump's withdrawal contradicts this stance</step> <count>17</count>  <reflection>While not explicitly contradictory, the actions described in both claims are at odds.  Macron seeks to uphold the agreement, while Trump intends to withdraw. This suggests a conflict of interest.</reflection>  <reward>0.96</reward>  Output: -1"
00100001,00270002,1,"Claim 1: British Prime Minister Theresa May expressed disappointment with President Donald Trump's decision to withdraw the United States from the Paris climate accord.  Claim 2: Angela Merkel said she was pleased that many other governments took the same view as her on the Paris climate accord.  Explanation: <thinking>Let's analyze how these statements relate to each other.</thinking>  <step>1. Identify subjects: Claim 1 focuses on May's reaction to U.S. withdrawal; Claim 2 highlights Merkel's satisfaction with other governments' stance on the Paris Agreement</step> <count>19</count>  <step>2.  Determine shared context: Both claims relate to international response to the U.S. withdrawing from the Paris climate accord</step> <count>18</count>  <step>3. Analyze connection: While different perspectives, both statements acknowledge support for the Paris Agreement after U.S. withdrawal</step> <count>17</count>  <reflection>Claims indirectly support each other by expressing agreement on importance of the Paris Agreement despite U.S. departure.</reflection> <reward>0.96</reward>  Output: 1"
00030002,02820002,1,"Claim 1: Comey's testimony is part of the Senate Intelligence Committee's probe into alleged Russian meddling in the U.S. presidential election and possible collusion with President Donald Trump's campaign.  Claim 2: Senator Cornyn stated the announcement could make it easier for the Senate to confirm President Donald Trump’s replacement of fired FBI Director James Comey.  Explanation: <thinking>Let's analyze the relationship between these claims.</thinking>  <step>1. Identify subjects: Claim 1 focuses on Comey's testimony within an investigation; Claim 2 discusses Senator Cornyn's view on Comey's replacement confirmation</step> <count>19</count>  <step>2. Explore connections:  Both claims involve James Comey and his firing by President Trump.</step> <count>18</count>  <step>3. Analyze indirect relationship: Claim 1 sets the context (Comey's testimony), while Claim 2 suggests an outcome (easier confirmation) potentially influenced by that context</step> <count>17</count>  <reflection>While not directly supporting each other, Claim 1 provides background information relevant to the situation described in Claim 2. There's a logical connection between the events.</reflection> <reward>0.88</reward>   Output: 1"
00010001,00180001,-1,"Claim 1: President Donald Trump on Thursday said he would withdraw the United States from the landmark 2015 global agreement to fight climate change.  Claim 2: French President Emmanuel Macron told U.S. President Donald Trump that the Paris climate deal could not be renegotiated.  Explanation: <thinking>Let's analyze the relationship between these two claims about the Paris Agreement.</thinking>  <step>1. Identify actions: Claim 1 states Trump's intention to withdraw; Claim 2 describes Macron's stance on renegotiation</step> <count>19</count>  <step>2. Evaluate implications:  Trump's withdrawal would directly oppose the Paris Agreement, while Macron's statement suggests resistance to altering the existing agreement.</step> <count>18</count>  <step>3. Analyze connection: While not explicitly contradictory, Macron's position implicitly conflicts with Trump's stated intention by highlighting the unacceptability of renegotiation.</step> <count>17</count>  <reflection>Claims indirectly contradict each other as Macron opposes a change that Trump seeks to enact.</reflection>   <reward>0.96</reward>  Output: -1"
00140003,03360001,-1,"Claim 1: U.S. Treasury Secretary Steven Mnuchin stated, ""we are very focused on working with them and I'm confident we'll get there before there's an issue.""  Claim 2: Robert Lighthizer is the New U.S. Trade Representative and vows to help reverse a 'dangerous trajectory' of U.S. trade.  Explanation: <thinking>Let's break down each claim and see if they relate.</thinking>  <step>1. Analyze Claim 1: Mnuchin expresses confidence in resolving an issue before it becomes a problem, implying cooperation</step> <count>19</count>  <step>2.  Analyze Claim 2: Lighthizer aims to reverse negative trade trends, suggesting a potentially conflicting approach</step> <count>18</count>  <step>3. Evaluate relationship: While both involve economic policy, Mnuchin's focus is on resolution, while Lighthizer seeks change; potential for conflict exists.</step> <count>17</count>  <reflection>Claims seem to present different perspectives within the same field, hinting at a possible contradiction but requiring further context. </reflection>  <reward>0.85</reward>    Output: -1"
00170002,01750002,1,"Claim 1: U.N. Secretary-General Antonio Guterres remains confident that cities, states, and businesses within the United States, along with other countries, will continue to demonstrate vision and leadership by working for low-carbon, resilient economic growth that will create quality jobs and markets for 21st century prosperity.  Claim 2: One component of the plan is creating jobs for people who want jobs and will come back into the workforce.   <thinking>Let's analyze the connections between these claims.</thinking>  <step>1. Identify core themes: Claim 1 focuses on sustainable economic growth with job creation, while Claim 2 specifically mentions a ""plan"" to create jobs for those re-entering the workforce.</step> <count>19</count>  <step>2. Evaluate direct support: Claim 2 doesn't explicitly mention low-carbon or resilient economic growth like Claim 1, but both point towards job creation as a positive outcome.</step> <count>18</count>  <step>3. Analyze indirect relationship: Both statements suggest a shared goal of job creation within different contexts (Claim 1 broader, Claim 2 more specific). </step> <count>17</count>  <reflection>While not directly supporting each other, the claims share a common theme of job creation and point towards similar economic goals. The level of connection is indirect but notable.</reflection> <reward>0.85</reward>   Output: 1"
00410001,03510002,1,"Claim 1: The White House disclosed a list of former lobbyists working in President Donald Trump's administration who have been issued ethics waivers on Wednesday.  Claim 2: The records are needed for an investigation into possible ties between Russia and President Donald Trump and his associates.  Explanation: <thinking>Let's analyze the connection between disclosing lobbyist information and a Russia investigation.</thinking>  <step>1. Identify Claim 1 Subject: Disclosure of former lobbyists with ethics waivers</step> <count>19</count>  <step>2. Identify Claim 2 Subject: Records needed for Russia investigation</step> <count>18</count>  <step>3. Analyze potential links: Lobbyist information *could* be relevant to a Russia investigation if there are suspicions of foreign lobbying or influence.</step> <count>17</count>  <reflection>While not explicitly stated, Claim 1's disclosure *might* provide useful information for Claim 2's investigation. The connection is indirect and requires further context/evidence.</reflection>  <reward>0.85</reward>    Output: 1"
00140003,02750001,1,"Claim 1: U.S. Treasury Secretary Steven Mnuchin stated, ""we are very focused on working with them and I'm confident we'll get there before there's an issue.""  Claim 2: U.S. House of Representatives Speaker Paul Ryan stated that their goal is to achieve tax reform during calendar year 2017.  Explanation: <thinking>Let's analyze the statements for support or contradiction regarding tax reform efforts.</thinking>  <step>1. Identify subject matter: Both claims relate to political action aiming for tax reform in 2017.</step> <count>19</count>  <step>2.  Analyze Mnuchin's statement: It expresses confidence in a successful outcome before an unspecified ""issue"" arises, suggesting active work toward achieving a goal.</step> <count>18</count>  <step>3. Analyze Ryan's statement: It explicitly states the House's aim to complete tax reform within 2017.</step> <count>17</count>  <step>4.  Assess relationship: While Ryan's statement is more direct, Mnuchin's implies a commitment to working towards achieving the same goal (tax reform) within that timeframe. </step> <count>16</count>  <reflection>Mnuchin's statement indirectly supports Ryan's by indicating shared intent and proactive efforts toward tax reform in 2017.</reflection> <reward>0.92</reward>    Output: 1"
00130001,01920001,1,"Claim 1: U.S. President Donald Trump spoke by phone to German Chancellor Angela Merkel, French President Emmanuel Macron, Canadian Prime Minister Justin Trudeau and British Prime Minister Theresa May to explain his decision to withdraw from the Paris climate accord on Thursday.  Claim 2: Former U.S. vice-president Al Gore said that U.S. President Donald Trump cannot stop the momentum to tackle climate change.  Explanation: <thinking>Let's analyze the relationship between these statements.</thinking>  <step>1. Identify subjects: Claim 1 focuses on Trump's communication after withdrawal decision; Claim 2 discusses global climate action sentiment despite U.S. stance</step> <count>19</count>  <step>2. Analyze connection: Both claims relate to U.S. withdrawal from Paris Agreement, but from different perspectives - Trump's actions and external reaction/opinion</step> <count>18</count>  <step>3. Evaluate indirect support: Claim 2 implies continued global effort despite U.S. exit, potentially a response to Trump's decision as highlighted in Claim 1.</step> <count>17</count>  <reflection>While not directly supporting each other, the claims touch on related events and offer contrasting viewpoints. Claim 2 indirectly responds to the context set by Claim 1.</reflection> <reward>0.88</reward>  Output: 1"
00210001,00630001,1,"Claim 1: The EU deeply regrets the unilateral decision by the Trump administration to withdraw the US from the Paris Agreement.  Claim 2: The Paris climate change deal does not infringe on U.S. sovereignty.  Explanation: <thinking>Let's analyze the relationship between these statements regarding the Paris Agreement.</thinking>  <step>1. Identify core topics: Claim 1 focuses on EU's reaction to US withdrawal; Claim 2 defends the Agreement against claims of sovereignty infringement</step> <count>19</count>  <step>2. Analyze connections: Both relate to the Paris Agreement, but from different perspectives (EU response vs defense)</step> <count>18</count>  <step>3. Consider indirect support: Claim 2 implicitly supports the Agreement's legitimacy, which EU likely upholds by regretting its withdrawal</step> <count>17</count>  <reflection>While not directly stating support, Claim 2 indirectly bolsters the EU's stance expressed in Claim 1. Both contribute to a narrative defending the Paris Agreement.</reflection>  <reward>0.92</reward>  Output: 1"
00270003,03470003,1,"Claim 1: U.S. President Donald Trump will announce later on Thursday his decision on whether to keep the United States in the landmark global pact to fight climate change.  Claim 2: The president is being very careful to understand how such a decision would impact a peace process.  Explanation: <thinking>Let's break down the relationship between these claims.</thinking>  <step>1. Identify subjects: Claim 1 focuses on Trump's climate pact decision; Claim 2 mentions his consideration of its impact on peace processes</step> <count>19</count>  <step>2. Analyze connection: While both relate to Trump's actions, Claim 2 suggests a broader rationale for his decision-making process (peace implications)</step> <count>18</count>  <step>3. Evaluate indirect support: Claim 2 provides context for Claim 1 by highlighting a factor influencing Trump's choice, not directly stating agreement/disagreement with the pact itself</step> <count>17</count>  <reflection>Claims are related indirectly; Claim 2 offers insight into Trump's thought process surrounding his climate pact decision, but doesn't directly support or contradict it.</reflection>  <reward>0.89</reward>  Output: 1"
