id1,id2,relation,response
00080002,03390002,1,"Claim 1: Emmanuel Macron stated that U.S. President Donald Trump’s decision to withdraw would harm American interests and citizens.  Claim 2: Dick Durbin said President Trump’s conduct, specifically disclosing sensitive, top secret information to the Russian foreign minister and ambassador, was “not only dangerous, it’s reckless.”  Explanation:  <thinking>Let's analyze if there is a relationship between these statements about Donald Trump.</thinking>  <step>1. Identify subjects: Claim 1 criticizes Trump's withdrawal decision; Claim 2 criticizes his conduct</step> <count>19</count>  <step>2. Evaluate connection: Both statements express negative opinions about Trump's actions as president</step> <count>18</count>  <step>3. Analyze relationship: While different aspects are criticized, both contribute to a broader negative view of Trump's presidency</step> <count>17</count>  <reflection>Claims indirectly support each other by sharing a common sentiment towards Trump's actions</reflection>  <reward>0.92</reward>  Output: 1"
00120002,05780001,1,"Claim 1: ""Today’s decision is a setback for the environment and for the U.S.’s leadership position in the world,""  Claim 2: President Trump declined to endorse the Paris Climate Agreement at the G7 summit.  Explanation: <thinking>Let's analyze the relationship between these statements based on their content.</thinking>  <step>1. Identify core message of Claim 1: It expresses disapproval of a decision (not specified) and its negative consequences for environment and US leadership</step> <count>19</count>  <step>2. Examine Claim 2: It states Trump's specific action - declining to endorse the Paris Agreement at a G7 summit</step> <count>18</count>  <step>3. Connect claims: While Claim 1 doesn't explicitly mention the Paris Agreement, the context suggests it refers to the same decision implied by Claim 2 (Trump's non-endorsement)</step> <count>17</count>  <reflection>Both statements address the same event: Trump's refusal to support the Paris Agreement. Claim 1 expresses a negative consequence interpretation of this action, while Claim 2 provides factual context.  They indirectly support each other.</reflection>  <reward>0.96</reward>  Output: 1"
00040003,00580001,1,"Claim 1: Robert Iger resigned from the President’s Council over the #ParisAgreement withdrawal, stating it was “as a matter of principle.”  Claim 2: Reports indicate Donald Trump is about to withdraw from the Paris accord.  Explanation: <thinking>Let's analyze the relationship between Iger's resignation and Trump's potential withdrawal.</thinking> <step>1. Identify actions: Claim 1 describes Iger resigning; Claim 2 states Trump's impending action</step> <count>19</count>  <step>2. Analyze motivation: Claim 1 attributes Iger's resignation to disagreement with Paris Agreement withdrawal</step> <count>18</count>  <step>3. Consider connection: If true, Claim 2 implies the reason for Iger's action in Claim 1.</step> <count>17</count>  <reflection>Claim 2 provides context explaining Iger's actions described in Claim 1, suggesting indirect support.</reflection> <reward>0.92</reward>   Output: 1"
00880003,06740002,1,"Claim 1: Trump's overseas journey took place amidst troubles facing him back home.  Claim 2: H.R. McMaster expressed concern about leaks within the White House after meetings with foreign dignitaries.  Explanation: <thinking>Let's analyze the connection between these statements.</thinking>  <step>1. Identify key events in Claim 1: Trump's overseas journey, troubles back home</step> <count>19</count>  <step>2. Analyze Claim 2: H.R. McMaster's concern about leaks after foreign meetings</step> <count>18</count>  <step>3. Evaluate connection:  Leaks could be considered a ""trouble"" for the administration, potentially stemming from overseas activities or internal disagreements exposed during the trip.</step> <count>17</count>  <reflection>While not explicitly stated, there's a plausible indirect relationship between leaks and troubles faced during the overseas journey. Claim 2 provides context that could support Claim 1.</reflection>  <reward>0.85</reward>  Output: 1"
00000001,02820002,1,"Claim 1: Former FBI Director James Comey will testify next Thursday before a U.S. Senate panel investigating Russia's alleged meddling in the 2016 U.S. election.  Claim 2: Senator Cornyn stated the announcement could make it easier for the Senate to confirm President Donald Trump’s replacement of fired FBI Director James Comey.  Explanation: <thinking>Let's analyze how these statements connect, focusing on factual content.</thinking>  <step>1. Identify key events: Claim 1: Comey's testimony; Claim 2: Confirmation process for Comey's replacement</step> <count>19</count>  <step>2. Determine relationship: Both statements involve Comey and the Senate, but with different focuses.</step> <count>18</count>  <step>3. Analyze potential connections: Senator Cornyn suggests Comey's testimony might influence the Senate's decision on his replacement. </step> <count>17</count>  <reflection> While statements aren't directly contradictory, there's a potential indirect relationship where Comey's testimony could impact a later event (confirmation process).  </reflection> <reward>0.88</reward>   Output: 1"
00440001,00930002,1,"Claim 1: A political dispute erupted over House Intelligence Committee subpoenas.  Claim 2: The Senate and House panels rejected his offer because of concerns that immunity agreements create complications for federal criminal investigators.  Explanation: <thinking>Let's analyze the relationship between these claims regarding political disputes and investigations.</thinking>  <step>1. Identify core subjects: Claim 1 focuses on a dispute about subpoenas; Claim 2 mentions Senate/House panels rejecting an offer related to immunity agreements</step> <count>19</count>  <step>2. Analyze potential connections: Both claims involve legislative bodies (House, Senate) and investigations (subpoenas, immunity agreements)</step> <count>18</count>  <step>3.  Consider indirect support: Claim 2 suggests the reason for rejecting an offer might be connected to the political dispute mentioned in Claim 1. The rejection could be part of the ""dispute"" itself.</step> <count>17</count>  <reflection>While not a direct contradiction, the second claim provides context and potentially explains factors contributing to the political dispute described in the first claim. </reflection>  <reward>0.85</reward>  Output: 1"
00860003,03920001,1,"Claim 1: Reuters reported last week that a proposal for a back channel was discussed between Mike Flynn and the Russian ambassador as Trump prepared to take office.  Claim 2: The U.S. Senate Intelligence Committee issued a subpoena to Michael Flynn.  Explanation: <thinking>Let's analyze the relationship between these two claims.</thinking>  <step>1. Identify Claim 1 subject: Discussion of back channel between Mike Flynn and Russian ambassador before Trump took office</step> <count>19</count>  <step>2. Identify Claim 2 subject: Subpoena issued to Michael Flynn by the Senate Intelligence Committee</step> <count>18</count>  <step>3. Evaluate potential connections: Both involve Mike Flynn, but one focuses on past events (discussion) and the other on present action (subpoena)</step> <count>17</count>  <step>4. Analyze indirect relationship: The subpoena could be related to the back channel discussion, as it might seek information about that event</step> <count>16</count>  <reflection>While not a direct support or contradiction, Claim 2 could be a consequence of events described in Claim 1.  More context would be needed for stronger determination.</reflection> <reward>0.85</reward>  Output: 1"
00030001,07300001,1,"Claim 1: James Comey will testify before the Senate Intelligence Committee on June 8. Claim 2: Who Do You Think President Trump Should Pick To Replace James Comey?  <thinking>Let's analyze the content and relationship between these statements.</thinking>  <step>1. Identify subjects: Claim 1 about Comey's testimony; Claim 2 about potential replacement</step> <count>19</count>  <step>2. Evaluate connection: Both relate to James Comey, but focus on distinct events - testifying vs. future position</step> <count>18</count>  <step>3. Analyze indirect relationship: Claim 2 implies Comey's position might be vacant due to testimony or circumstances surrounding it</step> <count>17</count>  <reflection>Claims indirectly relate as one event (testimony) could lead to the other (replacement). </reflection>  <reward>0.88</reward>  Output: 1"
00000002,03800002,1,"Claim 1: Comey will address the Senate Intelligence Committee in both an open session and behind closed doors. Claim 2: The meeting request is related to the Senate Intelligence Committee's investigation into alleged Russian meddling in the 2016 U.S. election.  <thinking>Let's analyze the connection between Comey's testimony and the Senate Intelligence Committee's investigation.</thinking>  <step>1. Identify subjects: Claim 1 about Comey's testimony format; Claim 2 about the investigation's purpose</step> <count>19</count>  <step>2.  Determine if claims overlap: Both statements involve the Senate Intelligence Committee and could be linked by a shared context.</step> <count>18</count>  <step>3. Analyze potential relationship: Comey's testimony likely pertains to the investigation, making it indirectly supportive of Claim 2.</step> <count>17</count>   <reflection>While not explicitly stating that Comey's testimony is about the investigation, his appearance before the committee strongly implies a connection to their work. </reflection>  <reward>0.92</reward>    Output: 1"
00000001,06900003,1,"Claim 1: Former FBI Director James Comey will testify next Thursday before a U.S. Senate panel investigating Russia's alleged meddling in the 2016 U.S. election.  Claim 2: Rex Tillerson stated that he has seen intelligence reports and believes Russia was involved in interfering with the U.S. election.  Explanation: <thinking>Let's analyze the relationship between these claims.</thinking>  <step>1. Identify subject of Claim 1: Testimony regarding Russian interference investigation</step> <count>19</count>  <step>2. Identify subject of Claim 2: Belief about Russia's involvement based on intelligence reports </step> <count>18</count>  <step>3. Analyze connection: Both claims relate to the topic of Russian interference in the 2016 election.</step> <count>17</count>  <step>4. Determine relationship type: Claim 2 provides potential background or context for Comey's testimony, as his testimony likely concerns this alleged interference.</step> <count>16</count>  <reflection>While not a direct contradiction or explicit support, there's an indirect link between the claims as they both touch on the same subject matter.</reflection> <reward>0.89</reward>  Output: 1"
00060003,00600001,1,"Claim 1: The debate about whether to stay in or withdraw from the Paris agreement within the White House lasted for several weeks.  Claim 2: President Donald Trump will withdraw the United States from a global pact to fight climate change.  Explanation: <thinking>Let's break down the relationship between these claims.</thinking>  <step>1. Identify Subject Matter: Claim 1 discusses internal deliberation; Claim 2 announces an action (withdrawal).</step>\ <count>19</count>  <step>2. Analyze Connection:  Claim 1 implies a decision was being made, while Claim 2 states the outcome of that decision.</step>\ <count>18</count>  <step>3. Assess Direct Relationship: Claim 2 provides evidence that supports the possibility discussed in Claim 1 (decision regarding Paris Agreement).</step>\ <count>17</count>  <reflection>While not a direct contradiction, Claim 2 reinforces the implications of Claim 1 by showcasing a result stemming from the internal debate. </reflection>\ <reward>0.96</reward>  Output: 1"
00250001,00440003,1,"Claim 1: Adam Schiff accused Devin Nunes of violating his recusal from its Russia probe by issuing three subpoenas to U.S. security and other officials.  Claim 2: The subpoenas requested details about requests made by Obama administration officials to ""unmask"" names of Trump campaign advisers in foreign communications intercepts.  Explanation: <thinking>Let's break down the relationship between these claims.</thinking>  <step>1. Analyze Claim 1: Focuses on Schiff's accusation against Nunes regarding subpoenas during a specific Russia probe.</step> <count>19</count>  <step>2. Analyze Claim 2: Provides context about the *content* of those subpoenas, seeking information about ""unmasking"" requests related to Trump campaign.</step> <count>18</count>  <step>3. Evaluate Connection: While both claims touch upon the same subpoenas, Claim 2 elaborates on their purpose, providing additional factual detail.</step> <count>17</count>  <reflection>Both claims revolve around the same set of subpoenas but from different perspectives. One focuses on the accusation and its context, while the other provides factual content about the subpoenas. This indirect relationship supports a nuanced understanding of the situation.</reflection> <reward>0.92</reward>   Output: 1"
00060002,04540003,1,"Claim 1: Trump stated that he was elected to represent Pittsburgh, not Paris, indicating a prioritization of domestic interests over global concerns.  Claim 2: White House spokeswoman Sarah Huckabee Sanders stated that President Donald Trump does not believe what works in Australia would necessarily work in the United States.  Explanation:  <thinking>Let's analyze if there is a connection between these statements about Trump's views.</thinking>  <step>1. Identify core message of Claim 1: Preference for domestic over global issues</step> <count>19</count>  <step>2. Examine Claim 2: Focus on applicability of foreign solutions to US context</step> <count>18</count>  <step>3.  Analyze potential connection: Both statements hint at skepticism towards applying solutions from other countries directly to the US, aligning with prioritizing domestic contexts</step> <count>17</count>   <reflection>While not a direct contradiction, both statements point toward a similar worldview within Trump's administration - favoring domestically tailored solutions.  The connection is indirect but plausible given the context.</reflection> <reward>0.88</reward>  Output: 1"
00060002,00070001,1,"Claim 1: Trump stated that he was elected to represent Pittsburgh, not Paris, indicating a prioritization of domestic interests over global concerns.  Claim 2: Removing the United States from the Paris Climate Agreement is a reckless and indefensible action. It undermines America’s standing in the world and threatens to damage humanity’s ability to solve the climate crisis in time. But make no mistake: if President Trump won’t lead, the American people will.  Explanation:  <step>1. Identify Claim 1 focus: Prioritization of domestic interests over global concerns</step> <count>19</count>  <step>2. Analyze Claim 2: Criticizes U.S. withdrawal from Paris Agreement (global concern)</step> <count>18</count>  <step>3. Connect statements: Claim 2 implies withdrawing from global agreement aligns with Claim 1's domestic focus</step> <count>17</count>  <reflection>Claims indirectly support each other by connecting Trump's statement about priorities with a policy action that exemplifies those priorities.</reflection>  <reward>0.96</reward>  Output: 1"
00040003,00210001,1,"Claim 1: Robert Iger resigned from the President’s Council over the #ParisAgreement withdrawal, stating it was “as a matter of principle.”  Claim 2: The EU deeply regrets the unilateral decision by the Trump administration to withdraw the US from the Paris Agreement.  Explanation: <thinking>Let's analyze the actions and sentiments expressed in both statements regarding the Paris Agreement.</thinking>  <step>1. Identify subject of Claim 1: Robert Iger resigning due to #ParisAgreement withdrawal</step>\ <count>19</count>  <step>2.  Identify subject of Claim 2: EU's disapproval of US withdrawal from #ParisAgreement</step>\ <count>18</count>  <step>3. Analyze relationship: Both claims center around the US withdrawal from the Paris Agreement, with different actors expressing their stances.</step>\ <count>17</count>  <reflection>Statements are related as they both address the same event (US withdrawal) but from different perspectives (personal action and international disapproval). </reflection>\ <reward>0.92</reward>  Output: 1"
00270003,00580003,1,"Claim 1: U.S. President Donald Trump will announce later on Thursday his decision on whether to keep the United States in the landmark global pact to fight climate change.  Claim 2: Steffen Kallbekken called Trump's move ""monumentally irresponsible"" and stated it would be a devastating blow to the Paris Agreement's momentum.  Explanation: <thinking>Let's analyze the relationship between these statements based on their content.</thinking> <step>1.  Identify Subject of Claim 1: Donald Trump's impending decision about U.S. participation in the Paris Agreement.</step>\n<count>19</count> <step>2. Identify Subject of Claim 2:  Steffen Kallbekken's reaction to Trump's anticipated decision regarding the Paris Agreement.</step>\n<count>18</count> <step>3. Analyze Relationship: Both statements directly relate to the same event - Trump's upcoming decision on the Paris Agreement. Claim 2 provides an opinion/reaction to the potential outcome described in Claim 1.</step>\n<count>17</count>  <reflection>While not a direct support, Claim 2 clearly reacts to and is influenced by the situation presented in Claim 1. They are connected through the shared topic.</reflection> <reward>0.96</reward>   Output: 1"
00880003,02380001,1,"Claim 1: Trump's overseas journey took place amidst troubles facing him back home.  Claim 2: According to the New York Times, President Donald Trump told Russian officials at the White House that firing FBI Director James Comey relieved 'great pressure' he was facing from an ongoing probe into Russia and the U.S. presidential election.  Explanation: <thinking>Let's analyze the connections between the claims.</thinking>   <step>1. Identify the issues in Claim 1: ""Troubles facing him back home"" are general and unspecified.</step> <count>19</count>  <step>2. Examine Claim 2 for specific troubles: It mentions pressure from a Russia probe and firing Comey as relieving that pressure.</step> <count>18</count>  <step>3. Assess connection: While both deal with Trump's difficulties, Claim 2 provides a concrete example of ""trouble"" mentioned in Claim 1.</step> <count>17</count>  <reflection>Claim 2 offers specific context for the general statement in Claim 1, suggesting a degree of support.</reflection> <reward>0.85</reward>  Output: 1"
00260002,06600003,1,"Claim 1: Nigel Farage's connections with Trump and Julian Assange's Wikileaks raised the interest of FBI investigators.  Claim 2: The investigation is into possible Russian interference in the 2016 presidential election.  Explanation: <thinking>Let's analyze the potential links between these claims.</thinking>   <step>1. Identify subjects: Claim 1 focuses on individuals and their connections; Claim 2 states the aim of an investigation</step> <count>19</count>  <step>2.  Explore potential connections: Could Farage, Trump, or Assange be connected to Russian interference?</step> <count>18</count>  <step>3. Analyze indirect relationship: While not explicitly stated, Claim 1 suggests a possible lead for the investigation outlined in Claim 2.</step> <count>17</count>  <reflection>The connection is indirect but plausible given the context of Russian interference investigations.</reflection> <reward>0.85</reward>  Output: 1"
00040001,00210001,1,"Claim 1: Elon Musk stated: ""Climate change is real. Leaving Paris is not good for America or the world.""  Claim 2: The EU deeply regrets the unilateral decision by the Trump administration to withdraw the US from the Paris Agreement.  Explanation: <thinking>Let's analyze the stances expressed in both statements.</thinking>  <step>1. Identify positions: Claim 1 expresses Musk's view on climate change and Paris withdrawal; Claim 2 conveys EU's disapproval of U.S. action regarding Paris</step> <count>19</count>  <step>2. Analyze agreement: Both statements acknowledge the U.S. withdrawal from the Paris Agreement as a negative event</step> <count>18</count>  <step>3. Evaluate indirect support: While not directly stating EU's position on climate change, Claim 2 implies concern by expressing regret over withdrawing from an agreement aimed at addressing it.</step> <count>17</count>  <reflection>Both claims address the Paris Agreement withdrawal negatively, with Claim 2 indirectly aligning with Claim 1's view on climate change. </reflection>  <reward>0.96</reward>  Output: 1"
00030001,02250002,1,"Claim 1: James Comey will testify before the Senate Intelligence Committee on June 8.  Claim 2: The hearing will be a public session scheduled after the May 29 Memorial Day holiday.  Explanation: <thinking>Let's analyze the relationship between these claims about James Comey's testimony.</thinking>  <step>1. Identify key details: Claim 1 specifies date (June 8); Claim 2 mentions post-Memorial Day scheduling</step> <count>19</count>  <step>2. Determine temporal connection: Both claims relate to the timing of the hearing</step> <count>18</count>  <step>3. Analyze support: Claim 2 provides context for the date mentioned in Claim 1 (hearing scheduled after Memorial Day, which precedes June 8)</step> <count>17</count>  <reflection>Claims indirectly support each other by establishing a temporal framework for the testimony. </reflection>  <reward>0.96</reward>  Output: 1"
00000003,07330002,1,"Claim 1: Comey was leading the FBI’s probe into the allegations, and his firing sparked a political uproar.  Claim 2: Kellyanne Conway stated that Trump's decision to fire James Comey was unrelated to the FBI's investigation into Russian interference in the presidential election.  Explanation: <thinking>Let's analyze the relationship between these statements regarding Comey's firing.</thinking>  <step>1. Identify key elements: Claim 1 mentions Comey leading an investigation and his firing causing uproar; Claim 2 states Conway's claim that the firing was unrelated to the investigation</step> <count>19</count>  <step>2. Compare claims: Both relate to Comey's firing, but from different perspectives - one describes consequences, the other offers an explanation.</step> <count>18</count>  <step>3. Analyze relationship: Claim 2 provides a potential reason/explanation for the situation described in Claim 1 (political uproar due to Comey's firing).</step> <count>17</count>  <reflection>While not directly supporting each other, Claim 2 offers an explanation for the events described in Claim 1. This suggests a degree of indirect support.</reflection> <reward>0.88</reward>   Output: 1"
00120001,05780001,1,"Claim 1: Goldman Sachs CEO Lloyd Blankfein criticized the United States' decision to withdraw from the Paris climate deal.  Claim 2: President Trump declined to endorse the Paris Climate Agreement at the G7 summit.  <thinking>Let's analyze the relationship between these statements regarding the Paris Climate Agreement.</thinking>  <step>1. Identify subject: Both claims relate to reactions and stances on the Paris Agreement</step> <count>19</count>  <step>2. Analyze Blankfein's criticism: It directly targets the US withdrawal decision, implying disapproval of the action</step> <count>18</count>  <step>3. Interpret Trump's stance: Declining to endorse at the G7 summit suggests opposition or reluctance towards the Agreement</step> <count>17</count>  <step>4. Connect actions and statements: Both actions (withdrawal & non-endorsement) align with opposition to the Agreement, reinforcing each other indirectly</step> <count>16</count>  <reflection>While not a direct contradiction, both claims demonstrate stances against the Paris Agreement, suggesting indirect support.</reflection> <reward>0.92</reward>  Output: 1"
00440001,01460002,1,"Claim 1: A political dispute erupted over House Intelligence Committee subpoenas.  Claim 2: Carter Page will testify before a House committee investigating alleged efforts by Russia to influence the U.S. election on June 6.  Explanation: <thinking>Let's examine the connection between the statements.</thinking>  <step>1. Identify key elements in Claim 1: ""political dispute,"" ""House Intelligence Committee subpoenas""</step> <count>19</count>  <step>2. Analyze Claim 2: Carter Page testifying before a House committee investigating Russian election interference.</step> <count>18</count>  <step>3.  Consider potential links: Subpoenas could be related to the investigation of Russian interference, potentially fueling the political dispute.</step> <count>17</count>  <reflection>While not explicitly stated, Claim 2 provides context that suggests a possible connection between the events described in both claims. </reflection> <reward>0.85</reward>  Output: 1"
